country,name,symbol,tag,id,issuer,isin,asset class
russia,Sberbank Small Cap Fund,0P0000WDGE,sberbank-small-cap,1065282,Sberbank Asset Management,RU000A0EQ3S1,other
russia,Vtb Electric Utilities,0P0000URD2,vtb-electric-utilities,1065323,VTB Capital Investment Management,,other
russia,Gazprombank - Russian Equities,0P00014MBQ,gazprombank-russian-equities,1065267,Gazprombank Asset Management (OJSC),,other
russia,Vtb Bric,0P0000URCF,vtb-bric,1065321,VTB Capital Investment Management,RU000A0JR4X3,other
russia,Tkb Bnp Paribas Balanced Conservative Russia,0P0000IU0S,tkb-bnp-paribas-balanced-con-russia,1065314,TKB BNP Investments Partners (OAO),,other
russia,Tkb Bnp Paribas Bond,0P0000IU0M,tkb-bnp-paribas-bond,1065315,TKB BNP Investments Partners (OAO),,other
russia,Allianz Rosno Stocks Acc,0P0000JTF2,allianz-rosno-stocks,1065278,Allianz ROSNO Asset Management,,other
russia,Vtb Metals & Mining,0P0000URCM,vtb-metals-mining,1065326,VTB Capital Investment Management,,other
russia,Raiffeisen Industrial,0P0000UT9Y,raiffeisen-industrial,1065304,Raiffeisen Capital Asset Management,,other
russia,Sberbank Emerging Markets,0P0000WDGW,sberbank-emerging-markets,1065284,Sberbank Asset Management,RU000A0JRLD0,other
russia,Arsagera - Equity Fund,0P0000M0F9,arsagera-equity,1065276,"Arsagera AM, OJSC",RU000A0HGNG6,other
russia,Energocapital-balanced,0P0000RR8M,energocapital-balanced,1065262,Energocapital Asset Management Comp JSC,RU000A0JR2K4,other
russia,Raiffeisen Emerging Markets,0P0000UT9Z,raiffeisen-emerging-markets,1065300,Raiffeisen Capital Asset Management,,other
russia,Vtb Consumer Goods & Services,0P0000URCS,vtb-consumer-goods-services,1065322,VTB Capital Investment Management,,other
russia,Vtb Promising Investments,0P0000URCR,vtb-promising-investments,1065329,VTB Capital Investment Management,,other
russia,Raiffeisen Europe,0P0000UTA0,raiffeisen-europe,1065302,Raiffeisen Capital Asset Management,,other
russia,Vtb Telecommunications,0P0000URCW,vtb-telecommunications,1065331,VTB Capital Investment Management,,other
russia,Tkb Bnp Paribas Equity Telecoms Russia,0P0000IU0Z,tkb-bnp-paribas-telecoms-russia,1065316,TKB BNP Investments Partners (OAO),,other
russia,Gazprombank - Russian Growth Fund,0P00014MBP,gazprombank-russian-growth,1065270,Gazprombank Asset Management (OJSC),,other
russia,Tkb Bnp Paribas Premium Fund Of Funds Commodity Gold Tracker,0P0000TEGV,tkb-bnp-paribas-premiumgold-tracker,1065318,TKB BNP Investments Partners (OAO),,other
russia,Allianz Rosno Balanced Acc,0P0000JTFK,allianz-rosno-balanced,1065274,Allianz ROSNO Asset Management,,equity
russia,Sberbank Europe,0P0000WDGU,sberbank-europe,1065283,Sberbank Asset Management,RU000A0JV9B2,other
russia,Allianz Rosno Second Tier Stocks,0P0000UUOD,allianz-rosno-second-tier-stocks,1065261,Allianz ROSNO Asset Management,,other
russia,Raiffeisen Precious Metals,0P0000UTA2,raiffeisen-precious-metals,1065306,Raiffeisen Capital Asset Management,,other
russia,Arsagera - Mixed Fund,0P0000M0FB,arsagera-mixed,1065275,"Arsagera AM, OJSC",RU000A0HGNH4,other
russia,Raiffeisen Second Tier,0P0000UTA3,raiffeisen-second-tier,1065307,Raiffeisen Capital Asset Management,,other
russia,Allianz Rosno Primary Industries Acc,0P0000JTF1,allianz-rosno-primary-industries,1065271,Allianz ROSNO Asset Management,,other
russia,Allianz Rosno Bonds Acc,0P0000JTF4,allianz-rosno-bonds,1065277,Allianz ROSNO Asset Management,,other
russia,Energocapital-global Markets,0P0000SVBI,energocapital-global-markets,1065263,Energocapital Asset Management Comp JSC,,other
russia,Allianz Rosno Domestic Growth Stocks Acc,0P0000JTFI,allianz-rosno-domestic-growth-stock,1065272,Allianz ROSNO Asset Management,,other
russia,Energocapital-saving,0P0000SVBJ,energocapital-saving,1065265,Energocapital Asset Management Comp JSC,,other
russia,Allianz Rosno Maximum,0P0000TQPG,allianz-rosno-maximum,1065279,Allianz ROSNO Asset Management,,other
russia,Energocapital-micex Index,0P0000SVBG,energocapital-micex-index,1065264,Energocapital Asset Management Comp JSC,,other
russia,Allianz Rosno Government Bonds,0P0000JTFJ,allianz-rosno-government-bonds,1065273,Allianz ROSNO Asset Management,,equity
saudi arabia,Alahli Saudi Riyal Trade Fund,0P00008MKM,alahli-saudi-riyal-trade,1024950,National Commercial Bank & Trust Co,,other
saudi arabia,Al Rajhi Commodities Mudaraba Fund - Sar,0P0000IU5Y,al-rajhi-commodities-mudaraba,1024934,Al Rajhi Capital,,other
saudi arabia,Samba Al Sunbullah Sar Fund,0P0000I42Q,samba-al-sunbullah,1024979,Samba Capital & Investment Management Co,,other
saudi arabia,Alahli Diversified Saudi Riyal Fund,0P00008W6D,alahli-div-sr-trade-fd,1025001,National Commercial Bank & Trust Co,,other
saudi arabia,Al Jazira Qawafel Commodities Trading,0P0000IU68,al-jazira-qawafel-commodities-tradi,1024982,Aljazira Capital,,other
saudi arabia,Hsbc Amanah Saudi Riyal Trading Fund,0P0000I280,hsbc-amanah-saudi-riyal-trading,1024974,HSBC Saudi Arabia Limited,,other
saudi arabia,Riyad Equity Fund 3,0P0000HGAW,riyad-equity-3,1024965,Riyad Capital Company,,equity
saudi arabia,Samba Al Raed Fund,0P0000I42Z,samba-al-raed,1024998,Samba Capital & Investment Management Co,,equity
saudi arabia,Saudi Fransi Money Market Fund Saudi Riyal,0P0000PT2V,sf-money-market-saudi-riyal,1025019,Saudi Fransi Capital,,bond
saudi arabia,Riyad Commodity Trading Fund Sar,0P0000HGB2,riyad-commodity-trading,1024967,Riyad Capital Company,,other
saudi arabia,Hsbc Amanah Saudi Equity Fund,0P0000I27T,hsbc-amanah-saudi-equity,1024975,HSBC Saudi Arabia Limited,,equity
saudi arabia,Riyad Equity Fund 2,0P0000HGAV,riyad-equity-2,1024963,Riyad Capital Company,,equity
saudi arabia,Samba Al Razeen Sar Fund,0P0000I42R,samba-al-razeen,1024980,Samba Capital & Investment Management Co,,other
saudi arabia,Samba Real Estate Fund,0P0000YQYN,samba-real-estate,1025049,Samba Capital & Investment Management Co,,other
saudi arabia,Saudi Fransi Al Badr Murabaha Sar,0P0000PST9,sf-al-badr-murabaha-sr,1025015,Saudi Fransi Capital,,other
saudi arabia,Saib Trade Finance,0P0000MXR1,saib-trade-finance,1024996,Alistithmar for Financial Securities and Brokerage,,other
saudi arabia,Alahli Saudi Trading Equity Fund,0P00008MKN,alahli-saudi-trd-equity,1024949,National Commercial Bank & Trust Co,,equity
saudi arabia,Falcom Financial Services Murabaha Fund Saudi Riyal,0P0000PTGF,falcom-murabaha,1025033,Falcom Financial Services,,other
saudi arabia,Albilad Asayil Fund,0P0000IUA7,albilad-asayel-saudi-shares,1024990,Al-Bilad Investment Co,,equity
saudi arabia,Anb Diyar Jeddah Real Estate,0P0000UGFT,anb-diyar-jeddah-real-estate,1025043,Arab National Investment Company,,equity
saudi arabia,Global Investment House Global Saudi Equity Sar,0P0000Q6KZ,global-saudi-equity,1025039,Global Investment House,,equity
saudi arabia,Samba Al-musahem Fund,0P0000I436,samba-al-musahem,1025000,Samba Capital & Investment Management Co,,equity
saudi arabia,Al Rajhi Saudi Share Fund,0P0000IU5V,al-rajhi-saudi-share,1024986,Al Rajhi Capital,,equity
saudi arabia,Alinma Saudi Riyal Liquidity Fund,0P0000SBOI,alinma-saudi-riyal-liquidity,1024944,Alinma Investment Company,,other
saudi arabia,Saudi Fransi Al Saffa Saudi Equity Trading Fund,0P0000PT2W,sf-al-saffa-saudi-equity-trading,1025020,Saudi Fransi Capital,,equity
saudi arabia,Al Jazira Taiyebat Saudi Equities Fund,0P0000IU67,al-jazira-taiyebat-saudi-equities,1024983,Aljazira Capital,,equity
saudi arabia,Riyad Money Fund Sar,0P0000HGAT,riyad-money,1025003,Riyad Capital Company,,bond
saudi arabia,Riyad Real Estate Fund Burj Rafal,0P0000USUK,riyad-real-estate-burj-rafal,1024961,Riyad Capital Company,,other
saudi arabia,Sr Murabaha (sr),0P0000KSXQ,jadwa-murabaha-sr,1024942,Jadwa Investment,,other
saudi arabia,Hsbc Amanah Multi-assets Balanced Fund,0P0000I27K,hsbc-amanah-multi-assets-balanced,1024970,HSBC Saudi Arabia Limited,,other
saudi arabia,Riyad Equity Fund 1,0P0000HGAU,riyad-equity-1,1024964,Riyad Capital Company,,equity
saudi arabia,Hsbc Saudi Freestyle Equity Fund,0P0000YQYF,hsbc-saudi-freestyle-equity,1025055,HSBC Saudi Arabia Limited,,equity
saudi arabia,Hsbc Saudi Equity Trading Fund,0P0000PTK4,hsbc-saudi-equity-trading,1025036,HSBC Saudi Arabia Limited,,equity
saudi arabia,Samba Al Ataa Saudi Equity Fund Sar,0P0000TI3J,samba-al-ataa-saudi-equity,1025044,Samba Capital & Investment Management Co,,equity
saudi arabia,Saudi Fransi Saudi Istithmar Equity Fund,0P0000PT2T,sf-saudi-istithmar-equity,1025018,Saudi Fransi Capital,,equity
saudi arabia,Riyad Gulf Fund,0P0000HGAY,riyad-gulf,1024966,Riyad Capital Company,,equity
saudi arabia,Alahli Gcc Trading Equity Fund,0P00008MKF,alahli-gcc-trd-eqty,1024948,National Commercial Bank & Trust Co,,equity
saudi arabia,Alawwal Saudi Riyal Murabaha Fund,0P0000PT8R,alawwal-saudi-riyal-murabaha,1024992,Alawwal Capital Company,,other
saudi arabia,Jadwa Saudi Equity Sar,0P0000KSXM,jadwa-saudi-equity,1024941,Jadwa Investment,,equity
saudi arabia,Anb Ai-saudi Equity Fund,0P0000IU9M,anb-al-arabi-saudi-equity,1024937,Arab National Investment Company,,equity
saudi arabia,Albilad Al-murabih Sar Fund,0P0000IUA8,albilad-al-murabih,1024991,Al-Bilad Investment Co,,other
saudi arabia,Saudi Fransi Real Estate Fund,0P00012R0W,sf-real-estate,1024958,Saudi Fransi Capital,,other
saudi arabia,Al-rajhi Gcc Equity Fund,0P0000IU9Y,al-rajhi-gcc-equity,1024939,Al Rajhi Capital,,equity
saudi arabia,Anb Al-mubarak Pure Saudi Equity Fund,0P0000PTI9,anb-al-mubarak-pure-saudi-equity,1024954,Arab National Investment Company,,equity
saudi arabia,Hsbc Saudi Equity Fund - Sef,0P0000RUVI,hsbc-saudi-equitysef,1025006,HSBC Saudi Arabia Limited,,equity
saudi arabia,Anb Ai-sar Money Market Fund,0P0000IU6E,anb-al-arabi-money-market,1024984,Arab National Investment Company,,bond
saudi arabia,Samba Gcc Equity (al Musahem),0P0000I42U,samba-gcc-musahem,1024997,Samba Capital & Investment Management Co,,equity
saudi arabia,Hsbc Amanah Multi-assets Growth Fund,0P0000I27P,hsbc-amanah-multi-assets-growth,1024973,HSBC Saudi Arabia Limited,,other
saudi arabia,Falcom Financial Services Ipo Fund,0P0000PTGI,falcom-ipo,1025034,Falcom Financial Services,,equity
saudi arabia,Hsbc Amanah Multi-assets Defensive Fund,0P0000I27L,hsbc-amanah-multi-assets-defensive,1024971,HSBC Saudi Arabia Limited,,other
saudi arabia,Hsbc Gcc Equity Income Fund,0P0000YQYH,hsbc-gcc-equity-income,1025054,HSBC Saudi Arabia Limited,,equity
saudi arabia,Falcom Financial Services Saudi Equity Fund,0P0000PTGE,falcom-saudi-equity,1025032,Falcom Financial Services,,equity
saudi arabia,Al Jazira Diversified Aggressive Fund,0P0000YQY8,al-jazira-diversified-aggressive,1025050,Aljazira Capital,,other
saudi arabia,Anb Al Mubarak Saudi Equity Sar,0P0000SBVO,anb-al-mubarak-saudi-equity,1024946,Arab National Investment Company,,equity
saudi arabia,Alahli Gcc Growth And Income Fund,0P0000USU9,alahli-gcc-growth-and-income,1024960,National Commercial Bank & Trust Co,,equity
saudi arabia,Hsbc Financial Institutional Fund,0P0000PTK2,hsbc-financial-institutions,1025035,HSBC Saudi Arabia Limited,,equity
saudi arabia,Hsbc Amanah Saudi Industrial Companies Equity Fund,0P0000I27R,hsbc-amanah-saudi-indl-companies-eq,1024976,HSBC Saudi Arabia Limited,,equity
saudi arabia,Bakheet Ipo Fund,0P0000IU61,bakheet-ipo,1024935,Osool and Bakheet Investment Company,,equity
saudi arabia,Riyad Al Jarei Fund,0P0000H79C,riyad-al-shamekh,1024932,Riyad Capital Company,,other
saudi arabia,Riyad Al Jarei Sharia Fund,0P0000H78Q,riyad-al-shamekh-sharia-compliant,1024930,Riyad Capital Company,,equity
saudi arabia,Riyad Al Mutahafedh Sharia Fund,0P0000HGBV,riyad-al-hadi-sharia-compliant,1024969,Riyad Capital Company,,other
saudi arabia,Alinma Saudi Equity Fund,0P0000SBOH,alinma-saudi-equity,1024945,Alinma Investment Company,,equity
saudi arabia,Alahli Saudi Mid And Small Cap Equity Fund,0P0000K7BV,alahli-saudi-mid-cap-equity,1024993,National Commercial Bank & Trust Co,,equity
saudi arabia,Saib Saudi Equity,0P0000MXQZ,saib-saudi-equity,1024994,Alistithmar for Financial Securities and Brokerage,,equity
saudi arabia,Hsbc Saudi Construction And Cement Eq Fd,0P0000I285,hsbc-saudi-construction-and-cement,1024978,HSBC Saudi Arabia Limited,,equity
saudi arabia,Samba Al Fareed Fund,0P0000I430,samba-al-fareed,1024999,Samba Capital & Investment Management Co,,equity
saudi arabia,Riyad Balanced Income Fund,0P0000HGBU,riyad-balanced-income,1024968,Riyad Capital Company,,equity
saudi arabia,Morgan Stanley Saudi Equity Fund,0P0000PU63,morgan-stanley-saudi-equity,1025037,Morgan Stanley Saudi Arabia,,equity
saudi arabia,Al Rajhi Petro-cement Sector F,0P0000IU5U,al-rajhi-petro-cement-sector-f,1024985,Al Rajhi Capital,,equity
saudi arabia,Aljazira Residential Projects Fund 2,0P00014BB3,aljazira-residential-projects-2,1025004,Aljazira Capital,,other
saudi arabia,Riyad Al Mutawazen Sharia Fund,0P0000H7A0,riyad-al-mokdam-sharia-compliant,1024933,Riyad Capital Company,,other
saudi arabia,Itqan Fund For Murabahat & Sukuk,0P0000YQYJ,itqan-for-murabahat-sukuk,1025056,Itqan Capital,,bond
saudi arabia,Al Rajhi Mena Dividend Growth Fund,0P0000YQY4,al-rajhi-mena-dividend-growth,1025045,Al Rajhi Capital,,equity
saudi arabia,Hsbc Amanah Gcc Equity Fund,0P0000I27M,hsbc-amanah-gcc-equity,1024972,HSBC Saudi Arabia Limited,,equity
saudi arabia,Saib Saudi Companies,0P0000MXQY,saib-saudi-companies,1024995,Alistithmar for Financial Securities and Brokerage,,equity
saudi arabia,Giamco Deem Liquidity Fund - Sar,0P00012R0Z,giamco-deem-liquidity,1024953,Gulf Investors Asset Management,,other
saudi arabia,Riyad Al Shuja’a Sharia Fund,0P0000H776,riyad-al-shujaa-sharia-compliant,1024929,Riyad Capital Company,,equity
saudi arabia,Riyad Al Shuja’a Fund,0P0000H77S,riyad-al-shujaa,1024931,Riyad Capital Company,,other
saudi arabia,Samba Gcc Raed Fund,0P0000I42T,samba-gcc-equity-al-raed,1024981,Samba Capital & Investment Management Co,,equity
saudi arabia,Hsbc Saudi Petrochemical Eq Opp Fd,0P0000I284,hsbc-saudi-petrochemical-equity-opp,1024977,HSBC Saudi Arabia Limited,,equity
saudi arabia,Al Jazira Diversified Balanced Fund,0P0000YQY7,al-jazira-diversified-balanced,1025046,Aljazira Capital,,other
saudi arabia,Saudi Fransi Al Qasr Gcc Real Estate And Construction Equity Trading Fund,0P0000PSTE,sf-al-qasr-gcc-real-estate-const,1025017,Saudi Fransi Capital,,equity
saudi arabia,Riyad Al Mutawazen Fund,0P0000H7D5,riyad-al-mokdam,1024962,Riyad Capital Company,,other
saudi arabia,Aljazira Gcc Income Fund,0P00012R0T,aljazira-gcc-income,1024956,Aljazira Capital,,equity
saudi arabia,Riyad Al Mutahafedh Fund,0P0000HGAN,riyad-al-hadi,1025002,Riyad Capital Company,,other
saudi arabia,Giamco Deem Saudi Equity Fund,0P00012R0Y,giamco-deem-saudi-equity,1024952,Gulf Investors Asset Management,,equity
saudi arabia,Alinma Multi Assets Defensive Fund,0P00012R0S,alinma-multi-assets-defensive,1024955,Alinma Investment Company,,other
saudi arabia,Al Jazira Diversified Conservative,0P0000YQYA,al-jazira-diversified-conservative,1025051,Aljazira Capital,,other
saudi arabia,Saudi Fransi Al Danah Gcc Equity Trading Fund.,0P0000PSTB,sf-al-danah-gcc-equity-trading,1025016,Saudi Fransi Capital,,equity
saudi arabia,Saib Sukuk Fund,0P0000SLZL,saib-sukuk,1025041,Alistithmar for Financial Securities and Brokerage,,bond
saudi arabia,Gcc Equity (sr),0P0000KSXN,jadwa-gcc-equity,1024940,Jadwa Investment,,equity
saudi arabia,Jadwa Arab Market Equity Sar,0P0000KSXP,jadwa-arab-market-equity,1024943,Jadwa Investment,,equity
saudi arabia,Al Jazira Residential Projects Fund,0P0000YQY9,al-jazira-residential-projects,1025052,Aljazira Capital,,other
saudi arabia,Saudi Fransi Emerging Markets Fixed Income,0P0000YQYP,sf-emerging-markets-fixed-income,1025048,Saudi Fransi Capital,,bond
saudi arabia,Bakheet Saudi Trading Equity Fund,0P0000IU62,bakheet-saudi-trading-equity,1024936,Osool and Bakheet Investment Company,,equity
saudi arabia,Blom Saudi Arabia Fund,0P0000TM61,blom-saudi-arabia,1024959,Blominvest Saudi Arabia,,equity
saudi arabia,Alawwal Periodical Income Fund,0P0000YQY3,alawwal-periodical-income,1024947,Alawwal Capital Company,,equity
saudi arabia,Alawwal Saudi Stock Market Fund,0P0000PT8S,alawwal-saudi-stock-market,1025021,Alawwal Capital Company,,equity
saudi arabia,Riyad Small And Medium Cap Fund,0P0000PRPG,riyad-small-and-medium-cap,1025013,Riyad Capital Company,,equity
saudi arabia,Riyad Al-emar Fund,0P0000PRPF,riyad-al-emar,1025014,Riyad Capital Company,,equity
singapore,Eastspring Investments - Japan Dynamic Fund - As,0P00011STA,eastspring-japan-dynamic-fund-class,1038910,Eastspring Investments (Luxembourg) S.A.,LU1019494514,equity
singapore,Ab - American Income Portfolio At Inc,0P0000N0AV,american-income-portfolio-at-ins,1037093,AllianceBernstein (Luxembourg) S.à r.l.,LU0289924671,bond
singapore,Ab - American Income Portfolio A2 Acc,0P0000YRKZ,american-income-portfolio-a2-acs,1037087,AllianceBernstein (Luxembourg) S.à r.l.,LU0289924598,bond
singapore,Ab - Global High Yield Portfolio I Inc,LP65068196,global-high-yield-portfolio-i-incs,1037185,AllianceBernstein (Luxembourg) S.à r.l.,LU0289962846,bond
singapore,Schroder International Selection Fund Hong Kong Equity C Accumulation Hkd,0P000013DN,sihong-kong-equity-c-acc,1042282,Schroder Investment Management Lux S.A.,LU0149536715,equity
singapore,Templeton Global Total Return Fund A(mdis)sgd,0P00009VE7,t-global-total-return-fund-a-mdis-s,1042603,Franklin Templeton Investment Funds,LU0320764169,bond
singapore,Hsbc Global Investment Funds - Economic Scale Japan Equity Pd,0P00001AMH,heconomic-scale-index-japan-equitys,1039917,HSBC Investment Funds (Luxembourg) S.A.,,equity
singapore,Templeton Global Bond Fund A(mdis)sgd,0P00009VEE,t-global-bond-fund-a-mdis-sgd,1042584,Franklin Templeton Investment Funds,LU0320763948,bond
singapore,Fidelity Funds - European Growth Fund Sr-acc-sgd,0P000161J9,fidelity-euro-growth-sr-acc-sgd,1085365,Fidelity (FIL Inv Mgmt (Lux) S.A.),LU1235259576,equity
singapore,Ubs (lux) Equity Fund - China Opportunity (usd) P Sgd Acc,0P0000Y4WK,ubs-lux-equity-fund-china-opportunp,1036711,UBS Fund Management (Luxembourg) S.A.,LU0880133367,equity
singapore,Jpmorgan Funds - Emerging Markets Equity Fund A (acc) - Sgd,0P0000MXQJ,jpem-equity-fund-a-acc-sgd,1040345,JPMorgan Asset Management (Europe) S.à r.l.,LU0456842615,equity
singapore,Fidelity Funds - European Growth Fund A-dist-eur,0P0000A4SW,european-growth-fund-a-dist-eus,1036035,Fidelity (FIL Inv Mgmt (Lux) S.A.),,equity
singapore,Fidelity Funds - America Fund Sr-acc-sgd (hedged),0P000161J3,fidelity-americafund-sraccsgdhdgd,1085460,Fidelity (FIL Inv Mgmt (Lux) S.A.),LU1235260079,equity
singapore,Fidelity Funds - America Fund Sr-acc-sgd,0P000161J2,fidelity-americafund-sr-acc-sgd,1085459,Fidelity (FIL Inv Mgmt (Lux) S.A.),LU1235257950,equity
singapore,Capital Group New Perspective Fund (lux) Bd,0P00016RPV,capital-group-new-perspective-funbs,1035892,Capital Group,LU1295551904,equity
singapore,Capital Group New Perspective Fund (lux) Zgd,0P00016RQW,capital-group-new-perspective-fuzgs,1035914,Capital Group,LU1295556531,equity
singapore,Capital Group New Perspective Fund (lux) B,0P00016RPP,capital-group-new-perspective-fubs,1035919,Capital Group,LU1295551490,equity
singapore,Capital Group New Perspective Fund (lux) Z,0P00016RQK,capital-group-new-perspective-funzs,1035902,Capital Group,LU1295555137,equity
singapore,Capital Group New Perspective Fund (lux) Zd,0P00016RQQ,capital-group-new-perspective-fuzds,1035908,Capital Group,LU1295555723,equity
singapore,Schroder International Selection Fund Asian Total Return A Distribution Sgd Av,0P0000RTUF,siasian-total-return-a-sgd-inc,1042122,Schroder Investment Management Lux S.A.,LU0553721365,equity
singapore,Ab - European Income Portfolio At Inc,0P0000N0BH,european-income-portfolio-at-incs,1037149,AllianceBernstein (Luxembourg) S.à r.l.,LU0289940362,bond
singapore,Dws Invest Top Dividend Sgd Lc,0P0000VWZJ,i-top-dividend-sgd-lc,1038803,Deutsche Asset Management S.A.,LU0740838460,equity
singapore,Dws Invest Top Dividend Sgd Ldq,0P0000TW4C,i-top-dividend-sgd-ldq,1038804,Deutsche Asset Management S.A.,LU0616864442,equity
singapore,Ab - American Growth Portfolio A Acc,0P0000LYHQ,american-growth-portfolio-a-acs,1037065,AllianceBernstein (Luxembourg) S.à r.l.,LU0289923608,equity
singapore,Ab - American Growth Portfolio C Acc,0P0000N0AP,american-growth-portfolio-c-acs,1037074,AllianceBernstein (Luxembourg) S.à r.l.,LU0289923947,equity
singapore,Ab - American Growth Portfolio I Acc,0P0000LYHS,american-growth-portfolio-i-acs,1037078,AllianceBernstein (Luxembourg) S.à r.l.,LU0289924085,equity
singapore,Ab - American Growth Portfolio B Acc,LP65058095,american-growth-portfolio-b-acs,1037069,AllianceBernstein (Luxembourg) S.à r.l.,LU0289979576,equity
singapore,First State Global Growth Funds - First State Dividend Advantage,0P0000KV3F,first-state-global-growth-fundsudiv,1029256,First State Investments (Singapore),,equity
singapore,First State Global Growth Funds - First State Dividend Advantage,0P00006ONO,first-state-global-growth-funds-div,1029150,First State Investments (Singapore),SG9999002083,equity
singapore,Jpmorgan Funds - Asia Pacific Income Fund A (mth) - Sgd,0P0000X32N,jpasia-pacific-income-fund-a-mth-sg,1040308,JPMorgan Asset Management (Europe) S.à r.l.,LU0831103253,equity
singapore,Ubs (lux) Bond Fund - Euro High Yield (eur) (sgd Hedged) P-mdist,0P0000ZZ1Q,ubs-bond-euro-high-yield-eur-pmdist,1065335,UBS Fund Management (Luxembourg) S.A.,LU0989134753,bond
singapore,First State Global Growth Funds - First State Bridge,0P00006OSF,first-state-global-growth-funds-fib,1029151,First State Investments (Singapore),SG9999002067,equity
singapore,Fullerton Sgd Income Fund - Class A,0P0000V29M,fullerton-sgd-income-fund-class-a,1029276,Fullerton Fund Management Company Ltd,SG9999008411,bond
singapore,Fullerton Sgd Income Fund - Class C,0P0000WGD0,fullerton-sgd-income-fund-class-c,1029279,Fullerton Fund Management Company Ltd,SG9999009088,bond
singapore,Fullerton Sgd Income Fund - Class B,0P0000W8JB,fullerton-sgd-income-fund-class-b,1029278,Fullerton Fund Management Company Ltd,SG9999008932,bond
singapore,Ubs Global Emerging Markets Opportunity Fund Sgd P,0P0000NDJ4,ubs-global-emerging-markets-opports,1033588,UBS Fund Management (Luxembourg) S.A.,IE00B5LN9509,equity
singapore,Ab - Eurozone Equity Portfolio B Sgd Acc,0P0000Q27S,eurozone-equity-portfolio-b-sgd-acc,1037161,AllianceBernstein (Luxembourg) S.à r.l.,LU0528103293,equity
singapore,Ab - Mortgage Income Portfolio A2 Acc,0P00017KOX,mortgage-income-portfolio-a2-sgd-ac,1037207,AllianceBernstein (Luxembourg) S.à r.l.,LU1021288425,bond
singapore,Ab - Mortgage Income Portfolio I2 Sgd Acc,0P00017KP1,mortgage-income-portfolio-i2-sgd-ac,1037227,AllianceBernstein (Luxembourg) S.à r.l.,LU1021292963,bond
singapore,Ab - Mortgage Income Portfolio At Sgd Inc,0P00017KP0,mortgage-income-portfolio-at-sgd-in,1037213,AllianceBernstein (Luxembourg) S.à r.l.,LU1021289316,bond
singapore,Schroder Asian Growth Fund Sgd Class,LP60005808,schroder-asian-growth-fund-sgd,1011312,Schroder Investment Mgmt (Singapore) Ltd,SG9999000327,equity
singapore,Schroder Asian Growth Fund Usd Class,LP61500847,schroder-asian-growth-fund-usd,1011314,Schroder Investment Mgmt (Singapore) Ltd,SG9999001689,equity
singapore,Ab - Eurozone Equity Portfolio A Sgd Acc,0P0000Q27P,eurozone-equity-portfolio-a-sgd-acc,1037158,AllianceBernstein (Luxembourg) S.à r.l.,LU0528102725,equity
singapore,Templeton Asian Smaller Companies Fund A(acc)sgd,0P0000I0ZR,tasc-a-acc-sgd,1042554,Franklin Templeton Investment Funds,LU0390135506,equity
singapore,Ab - Eurozone Equity Portfolio I Sgd Acc,0P0000Q282,eurozone-equity-portfolio-i-sgd-acc,1037166,AllianceBernstein (Luxembourg) S.à r.l.,LU0528103889,equity
singapore,Pinebridge Global Funds - India Equity Fund A5cp,0P0000Y7V3,pinebridge-global-funds-india-equit,1033586,PineBridge Investments Ireland Ltd,IE00B7N09G41,equity
singapore,Fidelity Funds - Asian Equity Fund S-acc-sgd,0P0000W75Q,asian-equity-fund-s-acc-sgd,1039025,Fidelity (FIL Inv Mgmt (Lux) S.A.),LU0605512861,equity
singapore,Aia Regional Equity Fund,0P00008T6M,aia-regional-equity-fund,1029231,AIA,,equity
singapore,Blackrock Global Funds - China Bond Fund A2,0P0000YRTZ,renminbi-bond-fund-a2h,1038051,BlackRock (Luxembourg) SA,LU0690034193,bond
singapore,Aia Acorns Of Asia Fund,0P00008SWX,aia-acorns-of-asia-fund,1029153,AIA,,equity
singapore,Hsbc Global Investment Funds - Chinese Equity Ac,0P0000N6LZ,hchinese-equity-class-acs,1039851,HSBC Investment Funds (Luxembourg) S.A.,,equity
singapore,Hsbc Global Investment Funds - Chinese Equity Ad,0P0000A4WR,hchinese-equity-class-ads,1039859,HSBC Investment Funds (Luxembourg) S.A.,,equity
singapore,Ubs (lux) Equity Fund - Greater China (usd) (sgd) P-acc,0P0000O3HS,ubs-equity-fund-greater-china-usd-s,1042784,UBS Fund Management (Luxembourg) S.A.,LU0501845795,equity
singapore,Eastspring Investments Unit Trusts - Singapore Select Bond Fund Class A,0P0000TS8U,eastspring-investments-unit-trusta,1029275,Eastspring Investments (Singapore) Ltd,SG9999007454,bond
singapore,Ab - Emerging Markets Debt Portfolio I2 Sgd Acc,0P00017KOM,em-debt-portfolio-i2-sgd-acc,1037118,AllianceBernstein (Luxembourg) S.à r.l.,LU0289934803,bond
singapore,Ab - Emerging Markets Debt Portfolio A2 Sgd Acc,0P00017KOL,em-debt-portfolio-a2-sgd-acc,1037117,AllianceBernstein (Luxembourg) S.à r.l.,LU0289932427,bond
singapore,Hsbc Portfolios - World Selection 3 Ac,0P0000RZ2W,h-portfolios-world-selection-3-clas,1040115,HSBC Investment Funds (Luxembourg) S.A.,,equity
singapore,Ab - Emerging Markets Growth Portfolio I Acc,LP65058097,em-growth-portfolio-i-acs,1037128,AllianceBernstein (Luxembourg) S.à r.l.,LU0289937145,equity
singapore,Ab - Emerging Markets Growth Portfolio C Acc,0P0000N0B8,em-growth-portfolio-c-accs,1037124,AllianceBernstein (Luxembourg) S.à r.l.,LU0289936683,equity
singapore,Fidelity Funds - Greater China Fund Ii S-acc-sgd,0P0000W75N,fidelity-funds-greater-china-fund-i,1029277,Fidelity (FIL Inv Mgmt (Lux) S.A.),LU0605518397,equity
