country,country_code,id,name,symbol,tag,currency
australia,au,959570.0,Betashares U.S. Equities Strong Bear Currency Hedg,BBUS,betashares-us-equities-strong-bear,AUD
australia,au,1055270.0,Betashares Active Australian Hybrids,HBRD,betashares-active-aust-hybrids,AUD
australia,au,38946.0,Australian High Interest Cash,AAA,betashares-aus-high-interest-cash,AUD
australia,au,1031301.0,Betashares Global Cybersecurity,HACK,betashares-global-cybersecurity,AUD
australia,au,1052291.0,Platinum Asia Fund Quoted Managed Hedge Fund,PAXX,platinum-asia-fund-quoted,AUD
australia,au,962166.0,Magellan Global Equities,MHG,magellan-global-equities,AUD
australia,au,959569.0,Betashares Nasdaq 100,NDQ,betashares-nasdaq-100,AUD
australia,au,959566.0,BetaShares Australian Equities Strong Bear Hedge,BBOZ,betashares-australian-equities-stro,AUD
australia,au,47715.0,Ishares Core S&P/Asx 200,IOZ,ishares-msci-aus200,AUD
australia,au,47719.0,SPDR S&P/ASX 200 Listed Property,SLF,spdr-s-p-asx200-listed-prop.-fund,AUD
australia,au,1050665.0,Platinum International Fund,PIXX,platinum-international-fund,AUD
australia,au,953173.0,VanEck Vectors Australian Equal Weight,MVW,market-vectors-australian-equal-wei,AUD
australia,au,962173.0,Vanguard MSCI Int Shares,VGS,vanguard-msci-int-shares,AUD
australia,au,38966.0,Vanguard Australian Fixed Interest,VAF,vanguard-aus.-fixed-interest,AUD
australia,au,1031305.0,BetaShares Global Sustainability Leaders,ETHI,betashares-global-sust-leaders,AUD
australia,au,38967.0,Vanguard Australian Shares,VAS,vanguard-aus.-shares-index,AUD
australia,au,38954.0,iShares S&P/ASX Dividend Opportunities,IHD,ishares-s-p-asx-high-dividend,AUD
australia,au,1129410.0,BetaShares Australian Investment Grade Corporate B,CRED,betashares-aus-inv-grd-corp-bd,AUD
australia,au,1117955.0,Perth Mint Gold,PMGOLD,perth-mint-gold,AUD
australia,au,47720.0,Vanguard Australian Property Securities,VAP,vanguard-aus.-prop.-securities,AUD
australia,au,986919.0,Vanguard Australian Corp Fixed Interest ,VACF,vanguard-australian-corporate-fixed,AUD
australia,au,38961.0,Russell Australian Select Corporate Bond,RCB,russell-aus-select-corp.-bond,AUD
australia,au,953176.0,VanEck Vectors MSCI World ex Australia Quality,QUAL,market-vectors-msci-world-ex-austra,AUD
australia,au,1096233.0,Betashares Asia Technology Tigers,ASIA,betashares-asia-technology-tigers,AUD
australia,au,1031753.0,VanEck Vectors Australian Floating Rate,FLOT,vaneck-vect-aust-floating-rate,AUD
australia,au,1073662.0,VanEck Vectors MSCI Multifactor Emerging Markets E,EMKT,vaneck-vectors-msci-mltfctr-em-eq,AUD
australia,au,1031309.0,Betashares Australian Bank Senior Floating Rate Bo,QPON,betashares-australian-bank-flt-rate,AUD
australia,au,47713.0,BetaShares Australian EquitiesBear,BEAR,betashares-aus.-eq.-bear-hedge,AUD
australia,au,1104674.0,VanEck Vectors China New Economy,CNEW,vaneck-vectors-china-new-economy,AUD
australia,au,1056186.0,BetaShares Australian Sustainability Leaders,FAIR,betashares-australian-sust-leaders,AUD
australia,au,962174.0,Vanguard MSCI Int Shares Hedged,VGAD,vanguard-msci-int-shares-hedged,AUD
australia,au,1104662.0,Betashares Global Quality Leaders,QLTY,betashares-global-quality-leaders,AUD
australia,au,962165.0,K2 Global Equities,KII,k2-global-equities,AUD
australia,au,962172.0,Vanguard Int Fixed Interest,VIF,vanguard-int-fixed-interest,AUD
australia,au,953165.0,BetaShares Australian Top 20 Equity Yield Maximise,YMAX,betashares-australian-top-20-equity,AUD
australia,au,37457.0,BetaShares Gold Bullion,QAU,betashares-gold,AUD
australia,au,1096101.0,WCM Quality Global Growth,WCMQ,wcm-quality-global-growth,AUD
australia,au,1077018.0,BetaShares Australia 200,A200,betashares-australia-200,AUD
australia,au,962160.0,ANZ Physical US Dollar,ZUSD,anz-physical-us-dollar,AUD
australia,au,1009163.0,BetaShares Strong US Dollar hedge fund,YANK,betashares-stg-usd-hdg-fnd,AUD
australia,au,1072052.0,BetaShares Legg Mason Real Income,RINC,betashares-legg-mason-real-income,AUD
australia,au,953166.0,BetaShares FTSE RAFI Australia 200,QOZ,betashares-ftse-rafi-australia-200,AUD
australia,au,47721.0,Vanguard Australian Shares High Yield,VHY,vanguard-aus.-shares-hyield,AUD
australia,au,37475.0,BetaShares US Dollar,USD,betashares-us-dollar,AUD
australia,au,1097716.0,BetaShares Global Robotics and Artificial Intellig,RBTZ,betashares-global-robotics-and-ai,AUD
australia,au,38951.0,iShares Core Composite Bond,IAF,ishares-ubs-composite-bond-index,AUD
australia,au,953179.0,SPDR S&P Global Dividend,WDIV,spdr-sp-global-dividend,AUD
australia,au,959568.0,BetaShares Geared US Equity Currency Hedged,GGUS,betashares-geared-us-equity-curr,AUD
australia,au,47696.0,iSharesGlobal 100,IOO,ishares-global-100,AUD
australia,au,47701.0,Vanguard All World Ex US Shares,VEU,vanguard-all-world-x-us-shares,AUD
australia,au,1031300.0,BetaShares Global Gold Miners,MNRS,betashares-global-gold-miners,AUD
australia,au,953177.0,SPDR Dow Jones Global Real Estate,DJRE,spdr-dow-jones-global-real-estate-a,AUD
australia,au,1137478.0,BetaShares Legg Mason Emerging Markets (Managed),EMMG,betashares-legg-mason-em,AUD
australia,au,959565.0,BetaShares Australian Dividend Harvester,HVST,betashares-australian-div-harvester,AUD
australia,au,47695.0,iSharesEurope,IEU,ishares-s-p-europe-350-aus,AUD
australia,au,1104657.0,Fidelity Global Emerging Markets,FEMX,fidelity-global-emerging-markets,AUD
australia,au,956402.0,ANZ SP ASX 300 High Yield Plus,ZYAU,anz-sp-asx-300-high-yield-plus,AUD
australia,au,1050173.0,VanEck Vectors FTSE Global Infrastructure,IFRA,vaneck-vectors-ftse-global-infrastr,AUD
australia,au,1055271.0,Vanguard Diversified Balanced,VDBA,vanguard-diversified-balanced,AUD
australia,au,47722.0,Vanguard US Total Market Shares,VTS,vanguard-us-tot.-market-shares,AUD
australia,au,47711.0,ETFS Physical Gold,GOLD,etfs-physical-gold-aus,AUD
australia,au,956401.0,ANZ SP 500 High Yield Low Vol,ZYUS,anz-sp-500-high-yield-low-vol,AUD
australia,au,47698.0,iShares Core S&P 500,IVV,ishares-s-p-500-aus,AUD
australia,au,38956.0,iShares S&P/ASX 20,ILC,ishares-s-p-asx-20,AUD
australia,au,962168.0,VanEck Vectors Gold Miners AU,GDX,market-vectors-gold-miners-au,AUD
australia,au,1031308.0,BetaShares Australian Ex-20 Portfolio Diversifier,EX20,betashares-australian-ex20-portf,AUD
australia,au,38950.0,SPDR S&P/ASX Australian Government Bond,GOVT,spdr-s-p-asx-aus-government-bond,AUD
australia,au,1013259.0,BetaShares Australian Small Companies Select Fund,SMLL,betashares-au-small-comp-select-fnd,AUD
australia,au,985880.0,Betashares Global Energy Companies,FUEL,betashares-global-energy-companies,AUD
australia,au,1031303.0,BetaShares Global Agriculture Companies,FOOD,betashares-global-agri-companies,AUD
australia,au,47691.0,iShares MSCI Emerging Markets,IEM,ishares-msci-emerging-markets-aus,AUD
australia,au,1052292.0,ETFS ROBO Global Robotics and Automation,ROBO,etfs-robo-global-robotics-auto,AUD
australia,au,1055274.0,Vanguard Diversified High Growth,VDHG,vanguard-diversified-high-growth,AUD
australia,au,953174.0,VanEck Vectors Australian Property,MVA,market-vectors-australian-property,AUD
australia,au,959567.0,BetaShares Geared Australian Equity Hedge,GEAR,betashares-geared-australian-equity,AUD
australia,au,38947.0,SPDR S&P/ASX Australian Bond,BOND,spdr-s-p-asx-australian-bond-fund,AUD
australia,au,986920.0,Vanguard FTSE Asia ex Japan,VAE,vanguard-ftse-asia-ex-japan-shares,AUD
australia,au,1052381.0,Vanguard Global Aggregate Bond Hedged,VBND,vanguard-global-aggr-bond-hedged,AUD
australia,au,1112806.0,Betashares Legg Mason Australian Bond,BNDS,betashares-legg-mason-australian-b,AUD
australia,au,37451.0,BetaShares Crude Oil Currency Hedged,OOO,betashares-crude-oil,AUD
australia,au,1031296.0,AMP Capital Dynamic Markets,DMKT,amp-capital-dynamic-markets,AUD
australia,au,37473.0,BetaShares British Pound,POU,betashares-british-pound-etf,AUD
australia,au,953186.0,Vanguard FTSE Emerging Markets,VGE,vanguard-ftse-emerging-markets-au,AUD
australia,au,47704.0,iShares MSCI Japan,IJP,ishares-msci-japan-aus,AUD
australia,au,38968.0,Vanguard Australian Government Bond,VGB,vanguard-aus.-govt-bond-index,AUD
australia,au,1077016.0,eInvest Income Generator,EIGA,einvest-income-generator,AUD
australia,au,1128756.0,VanEck Vectors MSCI World ex Australia Quality Hed,QHAL,vaneckvectors-msciworld-x-au-q-hdgd,AUD
australia,au,1031295.0,BetaShares Global Banks,BNKS,betashares-global-banks,AUD
australia,au,953168.0,BetaShares S&P 500 Yield Maximiser,UMAX,betashares-sp-500-yield-maximiser,AUD
australia,au,47708.0,iShares Asia 50,IAA,ishares-s-p-asia-50-aus,AUD
australia,au,38970.0,Vanguard MSCI Australian Small Companies,VSO,vanguard-msci-aus.-small-comp.,AUD
australia,au,1031297.0,BetaShares WisdomTree Japan,HJPN,betashares-wisdomtree-japan,AUD
australia,au,1138378.0,InvestSMART Ethical Share,INES,investsmart-ethical-share,AUD
australia,au,1094034.0,iShares Edge MSCI World Multifactor,WDMF,ishares-edge-msci-world-multifactor,AUD
australia,au,47710.0,ETFS Physical Silver,ETPMAG,etfs-physical-silver-aus,AUD
australia,au,47718.0,SPDR S&P/ASX 50,SFY,spdr-s-p-asx-50-fund,AUD
australia,au,962171.0,Vanguard Int Credit Securities,VCF,vanguard-int-credit-securities,AUD
australia,au,1057219.0,Montgomery Global Equities Fund,MOGL,montgomery-global-eqt-fd,AUD
australia,au,1055273.0,Vanguard Diversified Growth,VDGR,vanguard-diversified-growth,AUD
australia,au,1072346.0,VanEck Vectors MSCI International Sustainable Equi,ESGI,vaneck-vectors-msci-intl-sstnbl-eq,AUD
australia,au,1086961.0,InvestSMART Australian Equity Income Managed,INIF,investsmart-aus-equity-income-mngd,AUD
australia,au,47706.0,iShares Global Healthcare,IXJ,ishares-s-p-global-healthcare?cid=47706,AUD
australia,au,953182.0,SPDR S&P/ASX 200 Resources,OZR,spdr-sp-asx-200-resources,AUD
australia,au,1013273.0,ETFS Morningstar Global Technology,TECH,etfs-morningstar-global-technology,AUD
australia,au,962169.0,VanEck Vectors Morningstar Wide Moat,MOAT,market-vectors-morningstar-wide-moa,AUD
australia,au,985878.0,AMP Capital Global Infrastructure Securities,GLIN,amp-capital-global-infrastructure-s,AUD
australia,au,953169.0,iShares Global 100 AUD Hedged,IHOO,ishares-global-100-aud-hedged,AUD
australia,au,47707.0,iShares Global Consumer Staples,IXI,ishares-s-p-global-cons.-staples,AUD
australia,au,47692.0,iShares MSCI EAFE,IVE,ishares-msci-eafe-aud,AUD
australia,au,1072053.0,BetaShares Legg Mason Equity Income,EINC,betashares-legg-mason-equity-income,AUD
australia,au,47716.0,iShares S&P/ASX Small Ordinaries,ISO,ishares-s-p-asx-small-ordinaries,AUD
australia,au,1112797.0,Vanguard MSCI International Small Companies,VISM,vanguard-msci-intl-small-companies,AUD
australia,au,38955.0,iShares UBS Government Inflation,ILB,ishares-ubs-gov-inflation,AUD
australia,au,1031302.0,BetaShares Managed Risk Global Share,WRLD,betashares-managed-risk-glbl-share,AUD
australia,au,956399.0,UBS IQ MSCI Asia Apex 50 Ethical,UBP,ubs-iq-msci-asia-apex-50-ethical,AUD
australia,au,47714.0,Beta Shares S&P/ASX 200 Financials Sector,QFN,betashares-s-p-asx-200-financials,AUD
australia,au,1097697.0,Betashares Global Income Leaders,INCM,betashares-global-income-leaders,AUD
australia,au,1055272.0,Vanguard Diversified Conservative,VDCO,vanguard-diversified-conservative,AUD
australia,au,953181.0,SPDR S&P World Ex Australia Hedged,WXHG,spdr-sp-world-ex-australia-hedged,AUD
australia,au,953184.0,UBS IQ Research Preferred AU Dividend,DIV,ubs-iq-research-preferred-au-divide,AUD
australia,au,38960.0,Beta Shares S&P/ASX 200Resources Sector,QRE,betashares-s-p-asx-200-resources,AUD
australia,au,47717.0,Russell High Dividend Australian Shares,RDV,russell-high-div-aus.-shares,AUD
australia,au,47697.0,iShares Core S&P SmallCap 600,IJR,ishares-s-p-smallcap-600-aus,AUD
australia,au,38953.0,iSharesUBS Treasury,IGB,ishares-ubs-treasury-index-fund,AUD
australia,au,986921.0,Vanguard FTSE Europe Shares,VEQ,vanguard-ftse-europe-shares,AUD
australia,au,38965.0,SPDR MSCI Australia Select High Dividend Yield,SYI,spdr-msci-aus.-select-hi-div.-yi.,AUD
australia,au,38958.0,SPDR S&P/ASX 200 Financials ex AREITS,OZF,spdr-s-p-asx200-financials-x-reit,AUD
australia,au,38962.0,Russell Australian Government Bond,RGB,russell-aus.-government-bond,AUD
australia,au,1031298.0,BetaShares Global Healthcare,DRUG,betashares-global-healthcare,AUD
australia,au,953170.0,iShares S&P 500 AUD Hedged,IHVV,ishares-sp-500-aud-hedged,AUD
australia,au,47699.0,iShares CoreS&P MidCap 400,IJH,ishares-s-p-mcap-400,AUD
australia,au,47694.0,iShares China LargeCap,IZZ,ishares-ftse-china-25-aus,AUD
australia,au,38969.0,Vanguard MSCI Australian Large Companies,VLC,vanguard-msci-aus.-large-comp.,AUD
australia,au,953172.0,VanEck Vectors Australian Emerging Resources,MVE,market-vectors-australian-emerging,AUD
australia,au,1104663.0,Antipodes Global Shares,AGX1,antipodes-global-shares,AUD
australia,au,47693.0,iShares MSCI South Korea Capped AUD,IKO,ishares-msci-south-korea-aus,AUD
australia,au,1031304.0,BetaShares Managed Risk Australian Share,AUST,betashares-mgd-risk-australian-shr,AUD
australia,au,956395.0,UBS IQ MSCI Australia Ethical,UBA,ubs-iq-msci-australia-ethical,AUD
australia,au,953171.0,VanEck Vectors Australian Banks,MVB,market-vectors-australian-banks,AUD
australia,au,38963.0,Russell Australian SemiGovernment Bond,RSM,russell-aus-semi-gov-bond,AUD
australia,au,1008790.0,ANZ ETFS EURO STOXX 50,ESTX,anz-etfs-euro-stoxx-50,AUD
australia,au,38959.0,BetaShares Commodities Basket Currency Hedged,QCB,betashares-commodity-basket,AUD
australia,au,1094035.0,iShares Edge MSCI Australia Multifactor,AUMF,ishares-edge-msci-aus-multifactor,AUD
australia,au,956400.0,VanEck Vectors Small Companies Masters,MVS,market-vectors-small-cap-dividend,AUD
australia,au,953180.0,SPDR S&P World Ex Australia,WXOZ,spdr-sp-world-ex-australia,AUD
australia,au,962167.0,VanEck Vectors ChinaAMC CSI 300,CETF,market-vectors-chinaamc-a-share-syn,AUD
australia,au,953167.0,Betashares FTSE RAFI US 1000,QUS,betashares-ftse-rafi-us-1000,AUD
australia,au,953175.0,VanEck Vectors Australian Resources,MVR,market-vectors-australian-resources,AUD
australia,au,1031299.0,Betashares WisdomTree Europe,HEUR,betashares-wisdomtree-europe,AUD
australia,au,1129409.0,iShares JP Morgan USD Emerging Markets Bond (AUD H,IHEB,ishares-jp-morgan-usd-em-bd-aud-hdg,AUD
australia,au,1052293.0,ETFS Global Core Infrastructure,CORE,etfs-global-core-infrastructure,AUD
australia,au,37494.0,BetaShares Euro,EEU,betashares-euro-etf,AUD
australia,au,956397.0,UBS IQ MSCI World ex Australia,UBW,ubs-iq-msci-world-ex-australia,AUD
australia,au,1096102.0,ETFS Battery Tech & Lithium,ACDC,etfs-battery-tech-lithium,AUD
australia,au,962164.0,iShares MSCI Taiwan AU,ITW,ishares-msci-taiwan-au,AUD
australia,au,953183.0,SPDR S&P/ASX Small Ordinaries,SSO,spdr-sp-asx-small-ordinaries,AUD
australia,au,1136251.0,Vanguard Global Minimum Volatility Actv ETF (Mng),VMIN,vanguard-global-min-volactv-mng,AUD
australia,au,962170.0,SPDR MSCI World Quality Mix AU,QMIX,spdr-msci-world-quality-mix-au,AUD
australia,au,953178.0,SPDR S&P Emerging Markets,WEMG,spdr-sp-emerging-markets,AUD
australia,au,47703.0,ETFS Physical Platinum,ETPMPT,etfs-physical-platinum-aus,AUD
australia,au,1075248.0,Vanguard Global Value Equity Active,VVLU,vanguard-global-value-equity-active,AUD
australia,au,1128883.0,VanEck Vectors FTSE International Prop (Hdg),REIT,vaneck-vectors-ftse-intl-prop-hdg,AUD
australia,au,1135919.0,eInvest Future Impact Small Caps,IMPQ,einvest-future-impact-small-caps,AUD
australia,au,956398.0,UBS IQ MSCI Japan Ethical,UBJ,ubs-iq-msci-japan-ethical,AUD
australia,au,956396.0,UBS IQ MSCI US Ethical,UBU,ubs-iq-msci-us-ethical,AUD
australia,au,1129281.0,Vanguard Global Multi-Factor Active (Managed),VGMF,vanguard-globalmultifactoractivemng,AUD
australia,au,956394.0,UBS IQ MSCI Europe Ethical,UBE,ubs-iq-msci-europe-ethical,AUD
australia,au,985879.0,AMP Capital Global Property Securities,RENT,amp-capital-global-property-securit,AUD
australia,au,1057099.0,Theta Acbc Exch Traded Bond Units Mgr Sep-23,YTMMG2,theta-acbc-bd-units-mgr-sep23,AUD
australia,au,953185.0,UBS IQ Research Preferred AU Share,ETF,ubs-iq-research-preferred-au-share,AUD
australia,au,1031306.0,BetaShares Strong Australian Dollar hedge,AUDS,betashares-strong-aus-dollar,AUD
australia,au,962162.0,ANZS Physical Renminbi,ZCNH,anzs-physical-renminbi,AUD
australia,au,47702.0,ETFS Physical Precious Metal Basket,ETPMPM,etfs-physical-pm-basket-aus,AUD
australia,au,1057098.0,Theta Acbc Exch Traded Bond Units Gpt Aug-26,YTMGP1,theta-acbc-bd-units-gpt-aug26,AUD
australia,au,37440.0,BetaShares Agriculture Currency Hedged,QAG,betashares-agriculture-etf,AUD
austria,at,962154.0,iShares ATX UCITS DE,DE000A0D8Q23,ishares-atx-(de)?cid=962154,EUR
austria,at,1054750.0,ComStage MSCI Spain,LU1104577314,comstage-msci-spain?cid=1054750,EUR
austria,at,1054739.0,iShares Core S&P 500 UCITS,IE00B5BMR087,cs-etf-(ie)-on-s-p-500?cid=1054739,EUR
austria,at,1054740.0,iShares MSCI Europe UCITS Dist,IE00B1YZSC51,ishares-msci-europe---ie?cid=1054740,EUR
austria,at,1054741.0,db x-trackers ATX UCITS DR,LU0659579063,db-xtrackers-atx-de?cid=1054741,EUR
austria,at,1054742.0,db x-trackers DAX UCITS DR,LU0274211480,db-xtrackers-dax?cid=1054742,EUR
austria,at,1054743.0,iShares MSCI Poland UCITS,IE00B4M7GH52,ishares-msci-poland?cid=1054743,EUR
austria,at,1054745.0,ComStage EURO STOXX 50 NR UCITS,LU0378434079,comstage-euro-stoxx-50-nr?cid=1054745,EUR
austria,at,1054746.0,iShares EURO STOXX UCITS,DE000A0D8Q07,ishares-euro-stoxx-(de)-de?cid=1054746,EUR
austria,at,1054747.0,iShares NASDAQ-100 UCITS,DE000A0F5UF5,ishares-nasdaq-100?cid=1054747,EUR
austria,at,1054748.0,iShares FTSE MIB UCITS Acc,IE00B53L4X51,cs-etf-(ie)-on-ftse-mib?cid=1054748,EUR
austria,at,1054749.0,iShares S&P 500 UCITS Dist,IE0031442068,ishares-s-p-500---gbp?cid=1054749,EUR
austria,at,1054751.0,Deka EURO STOXX 50 UCITS,DE000ETFL029,etflab-euro-stoxx-50?cid=1054751,EUR
austria,at,1054737.0,iShares EURO STOXX 50 UCITS Dist,IE0008471009,ishares-dj-euro-stoxx-50-uk?cid=1054737,EUR
austria,at,1054752.0,iShares TecDAX UCITS,DE0005933972,ishares-tecdax-(de)-de?cid=1054752,EUR
austria,at,1054754.0,Vanguard S&P 500 UCITS USD Inc,IE00B3XXRP09,vanguard-s-p-500-uk?cid=1054754,EUR
austria,at,1054755.0,ComStage CAC 40 UCITS,LU0419740799,comstage-cac-40?cid=1054755,EUR
austria,at,1054756.0,ComStage PSI 20,LU0444605215,comstage-psi-20?cid=1054756,EUR
austria,at,1054757.0,iShares MDAX UCITS DE,DE0005933923,ishares-mdax-(de)-de?cid=1054757,EUR
austria,at,1054758.0,iShares SLI UCITS DE,DE0005933964,ishares-smi?cid=1054758,EUR
austria,at,1054759.0,ComStage SDAX TR UCITS,LU0603942888,comstage-sdax-tr?cid=1054759,EUR
austria,at,1054760.0,ComStage ATX UCITS,LU0392496690,comstage-atx?cid=1054760,EUR
austria,at,1054761.0,ComStage DAX TR UCITS,LU0378438732,comstage-dax-tr?cid=1054761,EUR
austria,at,1054762.0,Lyxor UCITS DAX,LU0252633754,lyxor-dax-pa?cid=1054762,EUR
austria,at,1054763.0,Source RDX UCITS,IE00B5NDLN01,rdx-source?cid=1054763,EUR
austria,at,1054738.0,db x-trackers S&P 500 UCITS 1C,LU0490618542,dbx-s-p-500-class-1-uk?cid=1054738,EUR
austria,at,1054736.0,iShares Core FTSE 100 UCITS,IE0005042456,ishares-ftse-100?cid=1054736,EUR
austria,at,962155.0,Lyxor UCITS Dow Jones Industrial Average D-EUR,FR0007056841,lyxor-dj-industrial-average?cid=962155,EUR
austria,at,1054722.0,ComStage Dow Jones Switzerland Titans 30 Net TR UC,LU0392496427,comstage-smi?cid=1054722,EUR
austria,at,962156.0,Lyxor MSCI Eastern Europe Ex Russia UCITS Acc,FR0010204073,lyxor-eastern-europe-(cece-eur)-de?cid=962156,EUR
austria,at,962157.0,Lyxor UCITS Stoxx 50 D-EUR,FR0007054358,lyxor-euro-stoxx-50?cid=962157,EUR
austria,at,1054714.0,iShares Dow Jones Industrial Average UCITS,DE0006289390,ishares-dj-industrial-average?cid=1054714,EUR
austria,at,1054715.0,db x-trackers STOXX Europe 600 UCITS DR 1C,LU0328475792,db-stoxx-europe-600-uk?cid=1054715,EUR
austria,at,1054716.0,db x-trackers FTSE 100 UCITS DR Income,LU0292097234,db-x-trackers-ftse-100-ucits-dr?cid=1054716,EUR
austria,at,1054717.0,Xtrackers Spain UCITS 1C,LU0592216393,xtrackers-spain-ucits?cid=1054717,EUR
austria,at,1054718.0,x-trackers Swiss Large DR 1D,LU0274221281,db-xtrackers-smi?cid=1054718,EUR
austria,at,1054719.0,db x-trackers Euro Stoxx 50 (DR) 1C,LU0380865021,db-euro-stoxx-50-1c-mc?cid=1054719,EUR
austria,at,1054720.0,db x-trackers Euro Stoxx 50 UCITS DR 1D,LU0274211217,db-x-trackers-dj-euro-stoxx-50-etf?cid=1054720,EUR
austria,at,1054721.0,SSgA SPDR S&P Euro Dividend Aristocrats,IE00B5M1WJ87,spdr-s-p-euro-dividend-aristocrats?cid=1054721,EUR
austria,at,1054723.0,Lyxor UCITS Russia (DJ Russia GDR) C-EUR,FR0010326140,lyxor-russia---dj-russia-gdr?cid=1054723,EUR
austria,at,1054735.0,db x-trackers CAC 40 UCITS 1D DR,LU0322250985,db-xtrackers-cac-40-de?cid=1054735,EUR
austria,at,1054724.0,SSgA SPDR S&P US Dividend Aristocrats,IE00B6YX5D40,spdr-s-p-us-dividend-aristocrats?cid=1054724,EUR
austria,at,1054725.0,db x-trackers MSCI Europe UCITS DR,LU0274209237,db-xtrackers-msci-europe-trn?cid=1054725,EUR
austria,at,1054726.0,db x-trackers MSCI USA UCITS DR,IE00BJ0KDR00,db-x-trackers-msci-usa-index?cid=1054726,EUR
austria,at,1054727.0,db x-trackers ShortDAX Daily UCITS 1C,LU0292106241,db-x-trackers-shortdax-daily?cid=1054727,EUR
austria,at,1054728.0,iShares MSCI Russia Adr/Gdr UCITS,IE00B5V87390,cs-etf-(ie)-on-msci-russia?cid=1054728,EUR
austria,at,1054729.0,iShares Core EURO STOXX 50 UCITS,IE00B53L3W79,cs-etf-(ie)-on-euro-stoxx-50?cid=1054729,EUR
austria,at,1054730.0,iShares S&P 500 EUR Hedged UCITS,IE00B3ZW0K18,ishares-s-p500-monthly-euro-hedged?cid=1054730,EUR
austria,at,1054731.0,db x-trackers FTSE MIB UCITS DR,LU0274212538,db-x-trackers-ftse-mib-index?cid=1054731,EUR
austria,at,1054732.0,db x-trackers MSCI EMU UCITS DR,LU0846194776,db-x-trackers-msci-emu-index?cid=1054732,EUR
austria,at,1054733.0,iShares STOXX Europe 50 UCITS,IE0008470928,ishares-dj-stoxx-50?cid=1054733,EUR
austria,at,1054734.0,iShares STOXX Europe 600 UCITS,DE0002635307,ishares-stoxx-europe-600-de?cid=1054734,EUR
austria,at,1054764.0,Deka DAX UCITS,DE000ETFL011,etflab-dax?cid=1054764,EUR
belgium,be,37493.0,Lyxor UCITS BEL 20 TR,BEL,lyxor-bel-20-tr,EUR
belgium,be,1131079.0,Source Goldman Sachs Equity Factor World UCITS,EFIWN,source-goldman-sachs-equity-factor?cid=1131079,HNL
brazil,br,39004.0,Ishares Ibovespa,BOVA11,ishares-ibovespa,BRL
brazil,br,998470.0,It Now Ibovespa Fundo De Indice,BOVV11,it-now-ibovespa-fundo-de-indice,BRL
brazil,br,39013.0,iShares BM&FBOVESPA Small Cap,SMAL11,ishares-bm-fbovespa-small-cap,BRL
brazil,br,39012.0,It Now PIBB IBrX-50,PIBB11,it-now-pibb-ibrx-50,BRL
brazil,br,1057399.0,XP MALLS FDO INV IMOB FII,XPML11,xp-malls-fdo-inv-imob-fii,BRL
brazil,br,956435.0,Fundo de Invest Ishares SP 500,IVVB11,fundo-de-invest-ishares-sp-500,BRL
brazil,br,1057218.0,Fundo de Investimento Imobiliario FII UBS BR Receb,UBSR11,fundo-inv-imob-fii-ubs-br,BRL
brazil,br,1057398.0,Malls Brasil Plural Fundo De Investimento Imobilia,MALL11,fii-malls-bp,BRL
brazil,br,1130948.0,General Shopping e Outlets do Brasil Fundo de Inve,GSFI11,generalshoppingeoutletsdobrasil-fii,BRL
brazil,br,39007.0,It Now IDIV,DIVO11,it-now-idiv,BRL
brazil,br,956434.0,It Now SP500 TRN,SPXI11,it-now-sp500-trn,BRL
brazil,br,39005.0,iShares IBrX Brasil,BRAX11,ishares-ibrx-brazil---ibrx100,BRL
brazil,br,39010.0,It Now IMAT,MATB11,it-now-imat,BRL
brazil,br,1097705.0,Votorantim Securities Master FII-FII,VOTS11,votorantim-securitiesmaster-fii-fii,BRL
brazil,br,1123180.0,Fundo de FI Imobiliario Kinea FII,KFOF11,fundo-de-fi-imobiliario-kinea-fii,BRL
brazil,br,39009.0,It Now IGCT,GOVE11,it-now-igct,BRL
brazil,br,37519.0,It Now IFNC,FIND11,it-now-ifnc,BRL
brazil,br,39008.0,iShares Carbono Eficiente (ICO2) Brasil,ECOO11,ishares-carbon-efficient-brasil,BRL
brazil,br,1112805.0,Fdo Inv Imob VBI Logístico,LVBI11,fdo-inv-imob-vbi-logistico,BRL
brazil,br,976602.0,CAIXA Ibovespa,XBOV11,caixa-ibovespa,BRL
brazil,br,976601.0,BB SP Dividendos,BBSD11,bb-sp-dividendos,BRL
brazil,br,1131605.0,Caixa Rio Bravo Fundo de Fundos de Investimento Im,CRFF11,rio-bravo-investimento-imobiliario,BRL
brazil,br,37518.0,It Now ISE,ISUS11,it-now-ise,BRL
brazil,br,1057217.0,Brazil Realty Fundo de Investimento Imobiliario FI,BZLI11,brazil-realty-fundo-inv-fii,BRL
brazil,br,1138387.0,Loft I - Fdo Inv Imob,LOFT11B,loft-i-fdo-inv-imob,BRL
bulgaria,bg,1024371.0,EXPAT Bulgaria SOFIX,BGX,expat-bulgaria-sofix,BGN
canada,ca,39046.0,BetaPro Crude Oil 2x Daily Bull,HOU,horizons-nymex-crude-oil-bull-plus,CAD
canada,ca,39045.0,BetaPro Crude Oil 2x Daily Bear,HOD,horizons-nymex-crude-oil-bear-plus,CAD
canada,ca,39072.0,iShares S&P/TSX 60,XIU,ishares-s-p-tsx-60,CAD
canada,ca,39043.0,BetaPro Natural Gas 2x Daily Bear,HND,horizons-nymex-natural-gas-bear-,CAD
canada,ca,39044.0,BetaPro Natural Gas 2x Daily Bull,HNU,horizons-nymex-natural-gas-bull-,CAD
canada,ca,39051.0,Horizons S&P/TSX 60,HXT,horizons-s-p-tsx-60-index,CAD
canada,ca,39039.0,BetaPro Canadian Gold Miners 2x Daily Bull,HGU,horizons-tsx-global-gold-bull-plus,CAD
canada,ca,48123.0,iShares S&P/TSX Global Gold,XGD,ishares-tsx-global-gold,CAD
canada,ca,48195.0,iShares S&P/TSX Capped Energy,XEG,ishares-tsx-capped-energy-fund,CAD
canada,ca,39038.0,BetaPro Canadian Gold Miners 2x Daily Bear,HGD,horizons-tsx-global-gold-bear-plus,CAD
canada,ca,39027.0,Horizons US Dollar Currency,DLR,horizons-u.s.-dollar-currency,CAD
canada,ca,48096.0,Horizons US Dollar Currency,DLRu,horizons-u.s.-dollar-currency?cid=48096,USD
canada,ca,48141.0,BMO S&P/TSX Equal Weight Banks,ZEB,bmo-tsx-equal-weight-banks-index,CAD
canada,ca,48197.0,iShares S&P/TSX Capped REIT,XRE,ishares-tsx-capped-reit,CAD
canada,ca,39047.0,Horizons Active Preferred Share CommonClass,HPR,horizons-preferred-share,CAD
canada,ca,976830.0,Vanguard FTSE Developed All Cap ex,VIU,vanguard-ftse-developed-all-cap-ex,CAD
canada,ca,48089.0,iShares Core S&P 500 (CAD Hedged),XSP,ishares-s-p-500-to,CAD
canada,ca,976625.0,BMO SP 500,ZSP,bmo-sp-500,CAD
canada,ca,39070.0,iShares Core S&P/TSX Capped Composite,XIC,ishares-tsx-capped-composite-fund,CAD
