country,country_code,id,name,symbol,tag,currency
switzerland,ch,47025.0,Lyxor UCITS EuroMTS 5-7Y Investment Grade DR,LYMTC,lyxor-euromts-5-7y-invest-grade-it,CHF
switzerland,ch,995523.0,iShares Global Inflation Linked Government Bond UC,IGIL,ishares-global-infl.-link-bond-$?cid=995523,USD
switzerland,ch,995871.0,Raiffeisen Solid Gold CHF Hedged,RGLDSH,raiffeisen-solid-gold-chf-hedged,CHF
switzerland,ch,1024561.0,UBS plc MSCI ACWI SF hedged A-Ukdis,ACCUKD,ubs-plc-msci-acwi-sf-hedged-a-ukdis,CHF
switzerland,ch,996902.0,UBS ETF MSCI World Socially Responsible UCITS USD,WSRCHA,ubs-msci-world-socially-resp.-a-de?cid=996902,CHF
switzerland,ch,995423.0,iShares Core UK Gilts UCITS,IGLT,ishares-ftse-uk-all-stks-gilt?cid=995423,GBP
switzerland,ch,995579.0,iShares MSCI Korea UCITS Acc,CSKR,cs-(ie)-on-msci-korea-de?cid=995579,USD
switzerland,ch,995840.0,ETFX Longer Dated All Commodities GO UCITS,COMF,etfs-longer-dated-all-commodities-g?cid=995840,CHF
switzerland,ch,996812.0,iShares MSCI Europe ex-UK UCITS,IEUX,ishares-msci-europe-ex-uk?cid=996812,CHF
switzerland,ch,995475.0,iShares STOXX Europe 50 UCITS,STOXX50EX,ishares-stoxx-europe-50?cid=995475,EUR
switzerland,ch,995510.0,iShares EURO STOXX Small UCITS,DJSC,ishares-dj-euro-stoxx-smallcap?cid=995510,CHF
switzerland,ch,995606.0,iShares MSCI EMU Large Cap UCITS,EMUL,ishares-msci-emu-large-cap?cid=995606,EUR
switzerland,ch,995508.0,iShares EURO STOXX Mid UCITS,DJMC,ishares-dj-euro-stoxx-midcap?cid=995508,CHF
switzerland,ch,996844.0,SPDR S&P 500 UCITS,SPY5,spdr-s-p-500-uk?cid=996844,CHF
switzerland,ch,995867.0,Market Access RICI Metals,MRMI,rbs-market-access-rici-metals?cid=995867,USD
switzerland,ch,995794.0,iShares FTSEurofirst 80 UCITS,IEUR,ishares-ftseurofirst-80---ie?cid=995794,CHF
switzerland,ch,995828.0,db x-trackers II Barclays Global Aggregate Bond UC,XBAE,db-x-tackers-ii-barclays-global-agg?cid=995828,EUR
switzerland,ch,949288.0,UBS - FTSE 100 UCITS GBP A-dis,100CHA,ubs-etf-ftse-100?cid=949288,CHF
switzerland,ch,996929.0,db x-trackers MSCI EM Asia UCITS 1C,XMAI,db-x-trackers-msci-em-asia-trn?cid=996929,USD
switzerland,ch,996931.0,Source EURO STOXX 50 B Total Return,SX5D,euro-stoxx-50-distributing-source?cid=996931,EUR
switzerland,ch,1089278.0,JPM EUR Ultra Short Income UCITS,JEST,jpm-eur-ultra-short-income-ucits,EUR
switzerland,ch,1096104.0,Lyxor UCITS MSCI Emerging Markets C-EUR,LEMC,lyxor-msci-emerging-markets?cid=1096104,CHF
switzerland,ch,1077023.0,Amundi Floating Rate USD Corporate UCITS,AFLC,amundi-floating-rate-usd-corp-ucits,CHF
switzerland,ch,996933.0,Source EURO STOXX Optimised Banks,S7XE,euro-stoxx-optimised-banks-source?cid=996933,EUR
switzerland,ch,996936.0,Market Access RICI Agriculture,MRAI,rbs-market-access-rici-agriculture?cid=996936,USD
switzerland,ch,1073297.0,Lyxor UCITS Australia (S&P ASX 200) D-EUR,LYAU2,lyxor-s-p-asx-200?cid=1073297,USD
switzerland,ch,996934.0,Source MSCI Europe,MXEU,msci-europe-source?cid=996934,EUR
switzerland,ch,1082062.0,HSBC FTSE EPRA/NAREIT Developed UCITS,HPRD,hsbc-ftse-epra-nareit-developed?cid=1082062,USD
switzerland,ch,1123704.0,Amun Ethereum,AETH,amun-ethereum,USD
switzerland,ch,1097703.0,JPMorgan US Research Enhanced Index Equity ESG UCI,JREU,jpmorgan-us-researchenhanced-eq-esg,DKK
switzerland,ch,996919.0,ComStage MSCI Europe Small Cap TRN UCITS,CBMINEUSUS,comstage-msci-europe-small-cap-trn?cid=996919,USD
switzerland,ch,996912.0,ComStage MSCI World TRN UCITS,CBMINWOUS,comstage-msci-world-trn?cid=996912,USD
switzerland,ch,996913.0,ComStage STOXX Europe 600 NR UCITS,CBSTOXXR,comstage-stoxx-europe-600-nr?cid=996913,CHF
switzerland,ch,996914.0,ComStage EURO STOXX 50 NR UCITS,CBSTOXX50EREU,comstage-euro-stoxx-50-nr?cid=996914,EUR
switzerland,ch,1138383.0,Lyxor Core Global Inflation-Linked 1-10Y Bond (DR),GIST,lyxor-coreglblinflink1-10y-bd-dr,CHF
switzerland,ch,1137527.0,iShares Glb High Yld Corp Bd UCITS CHF Hdg Acc,HYLC,ishares-glbhiyld-corpbd-chf-hdg-acc,CHF
switzerland,ch,1137523.0,iShares Global Corp Bond UCITS CHF Hdg Acc,CORC,ishares-global-corp-bnd-chf-hdg-acc,CHF
switzerland,ch,996915.0,ComStage MSCI EM Eastern Europe TRN UCITS,CBMINEE,comstage-msci-em-eastern-europetr?cid=996915,CHF
switzerland,ch,1136321.0,UBS (Irl) ETF plc - MSCI ACWI ESG Universal UCITS,AWESGWCHF,ubs-msci-acwi-esg-univ-hdgusd-a-acc,
switzerland,ch,996916.0,ComStage MSCI EM Eastern Europe TRN UCITS,CBMINEEUS,comstage-msci-em-eastern-europetr?cid=996916,USD
switzerland,ch,996917.0,ComStage MSCI Europe Mid Cap TRN UCITS,CBMINEUM,comstage-msci-europe-mid-cap-trn?cid=996917,CHF
switzerland,ch,1128890.0,Vanguard USD Treasury Bond UCITS USD Accumulation,VUTATR,vanguard-usd-treasurybond-ucits-acc,CHF
switzerland,ch,996920.0,ComStage STOXX Europe 600 Banks NR UCITS,CBSX7R,comstage-stoxx-europe-600-banks-nr?cid=996920,CHF
switzerland,ch,996928.0,ComStage STOXX Europe 600 Oil & Gas NR UCITS,CBSXER,comstage-stoxxeuro-600-oil-gas-nr?cid=996928,CHF
switzerland,ch,996921.0,ComStage STOXX Europe 600 Real Estate NR UCITS,CBSX86R,comstage-stoxx-europe-600-re-nr?cid=996921,CHF
switzerland,ch,1128884.0,WisdomTree Eurozone Quality Dividend Growth UCITS,EGRW,wisdomtree-ez-qualdiv-growth-ucits,EUR
switzerland,ch,996923.0,ComStage STOXX Europe 600 A&P NR UCITS,CBSXAR,comstage-stoxx600-auto.--parts-nr?cid=996923,CHF
switzerland,ch,1126188.0,iShares Electric Vehicles and Driving Technology U,ECAR,ishares-electricvehiclesdrivingtech?cid=1126188,USD
switzerland,ch,996924.0,ComStage STOXX Europe 600 Basic Resources NR UCITS,CBSXPREU,comstage-stoxx600-basic-res.-nr?cid=996924,EUR
switzerland,ch,996925.0,ComStage STOXX Europe 600 Basic Resources NR UCITS,CBSXPR,comstage-stoxx600-basic-res.-nr?cid=996925,CHF
switzerland,ch,1123025.0,Invesco US Treasury Bond 1-3 Year UCITS,TRE3,invesco-us-treasury-bond-1-3-y?cid=1123025,USD
switzerland,ch,996926.0,ComStage STOXX Europe 600 Construction & Materials,CBSXOREU,comstage-stoxx600-cons.---mat.-nr?cid=996926,EUR
switzerland,ch,1120036.0,JPMorgan Global Emerging Markets Research Enh Idx,JREM,jpmorgan-glbl-em-rsrchenhidxeq-esg,USD
switzerland,ch,996927.0,ComStage STOXX Europe 600 Health Care NR UCITS,CBSXDR,comstage-stoxx600-health-care-nr?cid=996927,CHF
switzerland,ch,1072261.0,UBS - MSCI World Socially Responsible UCITS,WSRUS,ubs-msci-world-soc-resp-ucits,USD
switzerland,ch,1056431.0,Lyxor USD Floating Rate Note Monthly Hedged D-CHF,LYFLOTH,lyxor-usd-float-rate-note-mnth-h,CHF
switzerland,ch,1072253.0,Franklin LibertyQ European Dividend UCITS,FLXD,franklin-libertyq-eu-div-ucits?cid=1072253,EUR
switzerland,ch,997005.0,UBS plc MSCI USA SF A-acc,MUUSAS,ubs-plc-msci-usa-sf-aacc,USD
switzerland,ch,996968.0,ComStage S&P 500 UCITS,CBGSPCUS,comstage-s-p-500?cid=996968,USD
switzerland,ch,996970.0,ComStage MSCI USA Small Cap TRN UCITS,CBMINUSSUS,comstage-msci-usa-small-cap-trn?cid=996970,USD
switzerland,ch,996971.0,Ossiam US Minimum Variance NR UCITS 1C,SPMV,ossiamus-minimum-variance-nr?cid=996971,EUR
switzerland,ch,956334.0,UBS MSCI Switzerland 20 35 UCITS CH,S2HSGA,ubs-msci-switzerland-20-35-ucits-ch,SGD
switzerland,ch,996973.0,Amundi ETF MSCI Emerging Asia UCITS,AASU,amundi-msci-em-asia-usd?cid=996973,USD
switzerland,ch,986888.0,Vanguard EUR Corporate Bond,VECP,vanguard-eur-corporate-bond?cid=986888,CHF
switzerland,ch,996974.0,Amundi ETF MSCI Nordic UCITS,CN1,amundi-msci-nordic?cid=996974,EUR
switzerland,ch,996975.0,Amundi ETF MSCI Europe Ex Switzerland UCITS,CS9,amundi-msci-europe-x-switzerland?cid=996975,EUR
switzerland,ch,996977.0,Lyxor UCITS FTSE EPRA/NAREIT Developed Europe D-EU,LYMEH,lyxor-msci-europe-real-estate?cid=996977,EUR
switzerland,ch,1024440.0,UBS plc MSCI ACWI SF hedged to JPY A-acc,ACWIJ,ubs-plc-msci-acwi-sf-hgd-jpy-aacc,JPY
switzerland,ch,1024385.0,UBS Bloomberg CMCI Composite,TCMCI,ubs-bloomberg-cmci-composite,USD
switzerland,ch,996979.0,Lyxor UCITS Privex D-EUR,LYPVX,lyxor-privex?cid=996979,EUR
switzerland,ch,1009228.0,Lyxor Euro Stoxx 50 DR Daily Hedged C-CHF,MSEC,lyxor-eustx50-dr-day-hedged-cchf-s,CHF
switzerland,ch,996981.0,Lyxor UCITS Stoxx Europe 600 Health Care,LYHLT,lyxor-stoxx-europe-600-health-care?cid=996981,EUR
switzerland,ch,986893.0,Vanguard FTSE Dev World,VEVE,vanguard-ftse-developed-world-l?cid=986893,CHF
switzerland,ch,996982.0,Lyxor UCITS Stoxx Europe Select Dividend 30,LYSEL,lyxor-stoxx-europe-select-div.-30?cid=996982,EUR
switzerland,ch,997002.0,iShares MSCI World Size Factor UCITS,IWSZ,ishares-msci-wrld-size-factor?cid=997002,USD
switzerland,ch,996983.0,Ossiam World Minimum Variance NR UCITS 1C,WOMV,ossiam-world-minimum-variance?cid=996983,EUR
switzerland,ch,997001.0,ComStage FTSE China A50,CBCHNCHF,comstage-ftse-china-a50,CHF
switzerland,ch,996999.0,Source Morningstar US Energy Infrastructure MLP UC,MLPS,source-morningsta-us-energy-inf-mlp?cid=996999,USD
switzerland,ch,996997.0,UBS (Irl) ETF plc – DJ Global Select Dividend UCIT,GLDVD,ubs-(irl)-dj-global-select-dividend?cid=996997,USD
switzerland,ch,996996.0,SPDR Euro Stoxx Low Volatility UCITS,ELOW,spdr-euro-stoxx-low-volatility?cid=996996,CHF
switzerland,ch,996994.0,Source Morningstar US Energy Infrastructure MLP UC,MLPD,source-morningstar-us-energy-inf-ml?cid=996994,USD
switzerland,ch,996985.0,ComStage CAC 40 UCITS,CBFCHIEU,comstage-cac-40?cid=996985,EUR
switzerland,ch,996993.0,Source Utilities S&P US Select Sector UCITS,XLUS,source-utilities-s-p-us-select-sect?cid=996993,USD
switzerland,ch,996990.0,CSOP Source FTSE China A50 UCITS,CHNA,csop-source-ftse-china-a50?cid=996990,USD
switzerland,ch,996988.0,Lyxor UCITS Dow Jones Industrial Average D-EUR,DJE,lyxor-dj-industrial-average?cid=996988,EUR
switzerland,ch,996986.0,Lyxor UCITS Daily ShortDAX x2 C-EUR,LYDSD,lyxor-daily-short-dax-x2?cid=996986,EUR
switzerland,ch,996967.0,ComStage S&P 500 UCITS,CBGSPC,comstage-s-p-500?cid=996967,CHF
switzerland,ch,1024734.0,UBS Bloomberg Barclays MSCI US Liquid Corporates S,CBSUST,ubs-bbg-brcls-msci-us-liq-corp-adis,CHF
switzerland,ch,996941.0,Market Access DAXglobal BRIC Index,MABI,rbs-market-access-dax-global-birc,USD
switzerland,ch,996952.0,ComStage HSI UCITS,CBHSI,comstage-hsi?cid=996952,CHF
switzerland,ch,996943.0,ComStage Commerzbank Bund-Future Short TR UCITS,CBBUNDS,comstage-bund-future-short-tr?cid=996943,CHF
switzerland,ch,1072051.0,Lyxor UCITS MSCI Korea C-EUR,LYKRWUSD,lyxor-msci-korea?cid=1072051,NZD
switzerland,ch,1067166.0,Xtrackers USD High Yield Corporate Bond UCITS,XUHY,xtrackers-usd-hiyld-corporate-bond?cid=1067166,USD
switzerland,ch,1065339.0,Lyxor MSCI ACWI Gold C EUR,GLDM,lyxor-msci-acwi-gold-c?cid=1065339,USD
switzerland,ch,996944.0,ComStage DAX TR UCITS,CBGDAXI,comstage-dax-tr?cid=996944,CHF
switzerland,ch,996946.0,ComStage DivDAX TR UCITS,CBGSULEU,comstage-divdax-tr?cid=996946,EUR
switzerland,ch,956322.0,db x-trackers Russell 2000 UCITS GB,XRS2,db-x-trackers-russell-2000-ucits-gb?cid=956322,USD
switzerland,ch,1057726.0,UBS Irl ETF plc - Global Gender Equality UCITS ETF,GENDER,ubs-glob-gender-eq-ucits-a-acc,USD
switzerland,ch,996947.0,ComStage FR DAX UCITS,CBGDAXP,comstage-fr-dax?cid=996947,CHF
switzerland,ch,996948.0,ComStage FR DAX UCITS,CBGDAXPEU,comstage-fr-dax?cid=996948,EUR
switzerland,ch,996949.0,ComStage SDAX TR UCITS,CBSDAXIEU,comstage-sdax-tr?cid=996949,EUR
switzerland,ch,1056188.0,UBS JPMorgan USD EM Diversified Bond 1-5 A-dis,SHEMB,ubs-jpm-usd-em-divers-bd-1-5-adis?cid=1056188,USD
switzerland,ch,956328.0,db x-trackers MSCI Europe UCITS,XEOU,db-x-trackers-msci-europe-ucits,USD
switzerland,ch,996954.0,ComStage Nikkei 225 UCITS,CBN225,comstage-nikkei-225?cid=996954,CHF
switzerland,ch,1024735.0,db x-trackers MSCI EMU DR 3C,XDUE,dbxtrck-msci-emu-dr-3c,CHF
switzerland,ch,996955.0,ComStage MSCI Russia 30 % Capped TRN UCITS,CBMINRUC,comstage-msci-russia-30-cappedtr?cid=996955,CHF
switzerland,ch,1045812.0,UBS MSCI USA ETF hedged A-acc,USGBPA,ubs-msci-usa-etf-hedged-aacc?cid=1045812,GBP
switzerland,ch,996957.0,ComStage SPI TR UCITS,CBSPI,comstage-spi-tr?cid=996957,CHF
switzerland,ch,996959.0,ComStage Dow Jones Industrial Average TM UCITS,CBDJI,comstage-dj-industrial-average?cid=996959,CHF
switzerland,ch,996960.0,ComStage MSCI USA Mid Cap TRN UCITS,CBMINUSM,comstage-msci-usa-mid-cap-trn?cid=996960,CHF
switzerland,ch,996961.0,ComStage MSCI USA Mid Cap TRN UCITS,CBMINUSMUS,comstage-msci-usa-mid-cap-trn?cid=996961,USD
switzerland,ch,1031752.0,UBS MSCI Japan UCITS hedged A-acc,JPGBPA,ubs-msci-japan-ucits-hedged-a-acc,GBP
switzerland,ch,996962.0,ComStage MSCI USA TRN UCITS,CBMINUS,comstage-msci-usa-trn?cid=996962,CHF
switzerland,ch,956329.0,iShares Euro Covered Bond UCITS,ICOV,ishares-eur-covered-bond?cid=956329,EUR
switzerland,ch,996963.0,ComStage Nasdaq-100 UCITS,CBNDXUS,comstage-nasdaq-100?cid=996963,USD
switzerland,ch,956330.0,iShares GBP Corporate Bond 1-5Yr UCITS,IS15,ishares-markit-iboxx-£-corp-bd-1-5?cid=956330,GBP
switzerland,ch,1024745.0,UBS MSCI EMU Socially Responsible hedged A-acc,EUSRS,ubs-msci-emu-socresp-hgd-aacc,CHF
switzerland,ch,1024742.0,UBS MSCI Japan Socially Responsible hedged A-Acc,JPSRE,ubs-msci-japan-socresp-hedged-aacc,EUR
switzerland,ch,997000.0,UBS MSCI EMU UCITS USD,EUUSAH,ubs-msci-emu-ucits-usd?cid=997000,USD
switzerland,ch,995468.0,iShares DivDAX UCITS DE,EXSB,ishares-divdax?cid=995468,CHF
switzerland,ch,996909.0,ComStage MSCI Pacific TRN UCITS,CBMINAP,comstage-msci-pacific-trn?cid=996909,CHF
switzerland,ch,995797.0,SPDR Barclays Cap US Treasury Bond,TRSY,spdr-barclays-us-treasury-bond-de?cid=995797,CHF
switzerland,ch,995805.0,UBS ETF Barclays Capital US 1-3Y Treasury Bond USD,UT1USA,ubs-etf-us-1-3-year-tr-bond-a-de?cid=995805,USD
switzerland,ch,995804.0,UBS ETF Markit iBoxx Germany 1-3 UCITS EUR A-dis,GS1EUA,ubs-markit-eur-germany-1-3-a-de?cid=995804,EUR
switzerland,ch,995803.0,db x-trackers II iBoxx Germany UCITS 1D,XBTR,db-x-trackers-ii-€-germany-tr-1d?cid=995803,EUR
switzerland,ch,995802.0,db x-trackers IIEmerging Markets Liquid Eurobond U,XEMB,db-em-liquid-eurobond---eur?cid=995802,EUR
switzerland,ch,995801.0,UBS ETF Markit iBoxx Liquid Corporates UCITS EUR A,ECOEUA,ubs-markit-eur-liquid-corps-a-de?cid=995801,EUR
switzerland,ch,995800.0,SPDR Barclays Capital 1-3 Yr Euro Govt Bond,SYB3,spdr-1-3-year-euro-gov-bond?cid=995800,CHF
switzerland,ch,995799.0,PIMCO Euro Short Maturity Source UCITS,PJS1,pimco-euro-short-maturity-source?cid=995799,EUR
switzerland,ch,995798.0,iShares Dow Jones Eurozone Sustainability Screened,SUBEEX,ishares-dj-eurozone-sust.-screened?cid=995798,EUR
switzerland,ch,995793.0,iShares FTSEurofirst 100 UCITS,IEUT,ishares-ftseurofirst-100---ie?cid=995793,CHF
switzerland,ch,995807.0,UBS ETF Barclays Capital US 7-10Y Treasury Bond US,UT7USA,ubs-etf-us-7-10-year-tr-bond-a-de?cid=995807,USD
switzerland,ch,995790.0,SSgA SPDR Barclays Emerging Markets Local Bond UCI,EMDL,spdr-barclays-em-local-bond-uk?cid=995790,CHF
switzerland,ch,995789.0,Lyxor UCITS EuroMTS 3-5Y Investment Grade DR,LYMTB,lyxor-euromts-3-5y-invest-grade?cid=995789,EUR
switzerland,ch,995788.0,Amundi ETF Govt Bond EuroMTS Broad Investment Grad,CB3,amundi-gov-bond-mts-broad-invest?cid=995788,EUR
switzerland,ch,995787.0,Amundi ETF Global Emerging Bond Markit iBoxx UCITS,AGEB,amundi-global-emrg-bond-iboxx?cid=995787,USD
switzerland,ch,995786.0,db x-trackers II iBoxx Global Inflation-Linked UCI,XGIN,db-global-inflation-tr---eur?cid=995786,EUR
switzerland,ch,995782.0,iShares STOXX Europe 600 Food & Beverage UCITS,SX3PEX,ishares-dj-stoxx600-food-beverage?cid=995782,EUR
switzerland,ch,995781.0,PIMCO Short-Term High Yield Corporate Bond Source,STHY,pimco-shterm-hyld-corp-bond-source?cid=995781,USD
switzerland,ch,995779.0,iShares Euro Government Bond 1-3Yr UCITS,IBGS,ishares-€-government-bond-1-3?cid=995779,CHF
switzerland,ch,995778.0,PIMCO Emerging Markets Advantage Local Bond Source,EMLB,pimco-emerging-markets-bond-index?cid=995778,USD
switzerland,ch,995806.0,UBS Barclays Cap US 5-7 Treasury Bond U USD,UT5USA,ubs-barclays-cap-us-5-7-trsrbd-usd,USD
switzerland,ch,995809.0,Amundi ETF Govt Bond Lowest Rated EuroMTS Investme,X1G,amundi-gov-bond-low-rate-mts-inv.?cid=995809,EUR
switzerland,ch,995775.0,Julius Baer Physical Gold EUR AX,JBGOEX,julius-baer-physical-gold-eur-ax,EUR
switzerland,ch,995841.0,Julius Baer Gold USD AX,JBGOUX,julius-baer-gold-usd-ax,USD
switzerland,ch,995850.0,Julius Baer Platinum EUR A,JBPLEA,julius-baer-platinum-eur-a,EUR
switzerland,ch,995848.0,Julius Baer Platinum USD A,JBPLUA,julius-baer-platinum-usd-a,USD
switzerland,ch,995847.0,Julius Baer Palladium CHF AX,JBPACX,julius-baer-palladium-chf-ax,CHF
switzerland,ch,995846.0,Julius Baer Palladium USD AX,JBPAUX,julius-baer-palladium-usd-ax,USD
switzerland,ch,995845.0,Julius Baer Palladium AX EUR,JBPAEX,julius-baer-palladium-ax-eur,EUR
switzerland,ch,995844.0,Julius Baer Palladium GBP A,JBPAGA,julius-baer-palladium-gbp-a,GBP
switzerland,ch,995843.0,Julius Baer Palladium CHF A,JBPACA,julius-baer-palladium-chf-a,CHF
switzerland,ch,995842.0,Julius Baer Palladium EUR A,JBPAEA,julius-baer-palladium-eur-a,EUR
switzerland,ch,995838.0,ComStage Commerzbank Commodity ex-Agriculture EW T,CBCOMMO,comstage-cbcommodity-x-agri.-ew-tr?cid=995838,CHF
switzerland,ch,995816.0,Amundi ETF US Treasury 3-7 UCITS,US3,amundi-us-treasury-3-7?cid=995816,USD
switzerland,ch,995836.0,Amundi MSCI World Energy USD,CWEUSD,amundi-msci-world-energy-usd,USD
switzerland,ch,995832.0,db xtrackers II iBoxx US Treasurie,XUTD,db-xtrackers-ii-iboxx-us-treasurie?cid=995832,USD
switzerland,ch,995831.0,iShares USD Ultrashort Bond UCITS,ERND,ishares-usd-ultrashort-bond-ucits?cid=995831,CHF
switzerland,ch,995829.0,iShares MSCI Europe Size Factor,IESZ,ishares-msci-europe-size-factor?cid=995829,EUR
switzerland,ch,995823.0,PIMCO Short-Term High Yield Corporate Bond Source,STHE,pimco-short-term-high-yield-corp-bo?cid=995823,EUR
switzerland,ch,995821.0,UBS ETF Barclays Euro Area Liquid Corporates 1-5 Y,CBEU5,ubs-barclays-euro-area-liquid-corp?cid=995821,EUR
switzerland,ch,995820.0,Lyxor UCITS iBoxx USD Treasuries 5-7Y DR,LYUS57,lyxor-iboxx-$-treasuries-5-7y--usd?cid=995820,USD
switzerland,ch,995819.0,Lyxor UCITS iBoxx USD Treasuries 1-3Y DR,LYUS13,lyxor-iboxx-$-treasuries-1-3y--usd?cid=995819,USD
switzerland,ch,995817.0,Amundi ETF US Treasury 7-10 UCITS,US7,amundi-us-treasury-7-10?cid=995817,USD
switzerland,ch,995777.0,UBS Barclays EUR Treasury 1-10 EUR,SS1EUA,ubs-barclays-eur-treasury-1-10-eur,EUR
switzerland,ch,995770.0,Julius Baer Physical Silver USD,JBSIUA,julius-baer-physical-silver-usd,USD
switzerland,ch,995852.0,Julius Baer Platinum CHF AX,JBPLCX,julius-baer-platinum-chf-ax,CHF
switzerland,ch,995529.0,iShares MSCI Eastern Europe Capped UCITS,IEER,ishares-msci-eastern-europe-10-40?cid=995529,USD
switzerland,ch,995583.0,iShares Emerging Asia Local Government Bond UCITS,IGEA,ishares-em-asia-local-gov-cap-bond?cid=995583,CHF
switzerland,ch,995581.0,db x-trackers II iTraxx Crossover 5y UCITS,XTXC,db-x-trackers-ii-crossover-5-y-tr?cid=995581,EUR
switzerland,ch,995573.0,iShares MSCI Brazil UCITS Acc,CSBR,cs-(ie)-on-msci-brazil-de?cid=995573,USD
switzerland,ch,995567.0,iShares MSCI Australia UCITS,SAUS,ishares-msci-australia-de?cid=995567,AUD
switzerland,ch,995566.0,iShares MSCI South Africa UCITS,SRSA,ishares-msci-south-africa-de?cid=995566,USD
switzerland,ch,995563.0,iShares S&P 500 EUR Hedged UCITS,ISIUSE,ishares-s-p500-monthly-euro-hedged?cid=995563,EUR
switzerland,ch,995443.0,iShares US Aggregate Bond UCITS,IUAG,ishares-barclays-us-agg-bond?cid=995443,USD
switzerland,ch,995536.0,iShares Agribusiness UCITS,ISAG,s-p-commodity-producers-agri.?cid=995536,CHF
switzerland,ch,995520.0,iShares Global Corporate Bond UCITS,CORP,ishares-global-corporate-bond-$?cid=995520,USD
switzerland,ch,995610.0,iShares Euro Ultrashort Bond UCITS,ERNE,ishares-euro-ultrashort-bond?cid=995610,CHF
switzerland,ch,995511.0,iShares EURO Total Market Value Large UCITS,IDJV,ishares-dj-euro-stoxx-value?cid=995511,CHF
switzerland,ch,995460.0,iShares STOXX Europe 600 Utilities UCITS,SX6PEX,ishares-eurostoxx-600-utilities?cid=995460,EUR
switzerland,ch,995492.0,iShares MSCI Pacific ex-Japan UCITS Dist,SPXJ,ishares-msci-pacific-ex-japan-uk?cid=995492,USD
switzerland,ch,995462.0,iShares STOXX Europe 600 Banks UCITS,SX7PEX,ishares-dj-stoxx600-banks?cid=995462,EUR
switzerland,ch,995464.0,iShares STOXX Europe 600 Telecommunications UCITS,SXKPEX,ishares-eurostoxx-600-telecom--de?cid=995464,EUR
switzerland,ch,995484.0,iShares Euro Government Bond 7-10Yr UCITS Acc,CSBGE0,cs-etf-(ie)-on-iboxx-eur-govt-7-10?cid=995484,EUR
switzerland,ch,995476.0,iShares MSCI UK Small Cap UCITS,CSUKS,cs-etf-(ie)-on-msci-uk-small-cap?cid=995476,GBP
switzerland,ch,995471.0,iShares MDAX UCITS DE,MDAXEX,ishares-mdax-(de)-de?cid=995471,CHF
switzerland,ch,995470.0,iShares MSCI Japan Small Cap UCITS Dist,ISJP,ishares-msci-japan-small-cap?cid=995470,JPY
switzerland,ch,995608.0,iShares $ Short DurationHigh Yield Corporate Bond,SDHY,ishares-usd-short-duration-high-yie?cid=995608,CHF
switzerland,ch,995433.0,iShares MSCI Poland UCITS,SPOL,ishares-msci-poland?cid=995433,USD
switzerland,ch,995769.0,Julius Baer Physical Palladium USD,JBPAUA,julius-baer-physical-palladium-usd,USD
switzerland,ch,995428.0,iShares MSCI Japan EUR Hedged UCITS,IJPE,ishares-msci-japan-mon.-euro-hed.?cid=995428,EUR
switzerland,ch,995766.0,UBS Barclays Euro Liquid Corp 1-5 hedged USD,CBEU5U,ubs-barclays-eur-lqd-corp-1-5-hdgd,USD
switzerland,ch,995754.0,Julius Baer Physical Gold CHF AX,JBGOCX,julius-baer-physical-gold-chf-ax,CHF
switzerland,ch,995411.0,iShares Euro Aggregate Bond UCITS,IEAG,ishares-euro-aggregate-bd-eur?cid=995411,CHF
switzerland,ch,995746.0,UBS Barclays US Liquid Corp hedged GBP,CBUSH,ubs-barclays-us-lqd-corp-hdgd-gbp,GBP
switzerland,ch,995745.0,UBS Barclays US Liquid Corp 1-5 hedged GBP,CBUS5H,ubs-barclays-us-lqdcrp-1-5-hdgd-gbp,GBP
switzerland,ch,995699.0,iShares Fallen Angels HY Corp Bnd,ISWING,ishares-fallen-angels-hy-corp-bnd?cid=995699,USD
switzerland,ch,995696.0,iShares US Mortgage Backed Sec,IMBS,ishares-us-mortgage-backed-sec?cid=995696,USD
switzerland,ch,995692.0,iShares TA-25 Israel,TASE,ishares-ta25-israel-ucits?cid=995692,USD
switzerland,ch,995671.0,iShares MSCI EM Consumer Growth,CEMG,ishares-msci-em-consumer-growth?cid=995671,USD
switzerland,ch,995618.0,iShares MSCI Europe Momentum UK,IEMO,ishares-msci-europe-momentum-uk?cid=995618,EUR
switzerland,ch,995665.0,iShares Euro Corp Bnd Financials,IECF,ishares-euro-corp-bnd-financials?cid=995665,CHF
switzerland,ch,995663.0,iShares Global AAA-AA Govt Bnd,IAAA,ishares-global-aaa-aa-govt-bnd?cid=995663,USD
switzerland,ch,995658.0,iShares Global Corp Bnd EUR Hdg,CRPH,ishares-global-corp-bnd-eur-hdg?cid=995658,EUR
switzerland,ch,995655.0,iShares Edge MSCI Europe Min Vol,MVEU,ishares-edge-msci-europe-min-vola?cid=995655,CHF
switzerland,ch,995648.0,iShares Edge MSCI USA MF GBp,IFSU,ishares-edge-msci-usa-mf-gbp?cid=995648,USD
switzerland,ch,995644.0,iShares USD Short Duration Corp Bond UCITS,SDIG,ishares-usd-short-duration-corp-bnd?cid=995644,CHF
switzerland,ch,995637.0,iShares MSCI World Quality Factor UCITS,IWQU,ishares-msci-wrld-quality-factor?cid=995637,USD
switzerland,ch,995630.0,iShares MSCI EM Minimum Volatility,EMLV,ishares-msci-em-minimum-volatility?cid=995630,CHF
switzerland,ch,995620.0,iShares US Equity Buyback Achievers,BACK,ishares-us-equity-buyback?cid=995620,USD
switzerland,ch,995851.0,Julius Baer Platinum EUR AX,JBPLEX,julius-baer-platinum-eur-ax,EUR
switzerland,ch,995854.0,Julius Baer Silver GBP A,JBSIGA,julius-baer-silver-gbp-a,GBP
switzerland,ch,996907.0,ComStage Commerzbank FED Funds Effective Rate TR U,CBFEDFERUS,comstage-cbfeds-effective-rate-tr?cid=996907,USD
switzerland,ch,996825.0,Market Access DAX global Russia Index,MDRI,rbs-market-access-daxglobal-russia,USD
switzerland,ch,996845.0,db x-trackers Nifty 50,XNIF,db-xtrackers-s-p-cnx-nifty-uk?cid=996845,USD
switzerland,ch,996843.0,Lyxor UCITS Stoxx Europe 600 Telecommunications,LYTEL,lyxor-stoxx-europe-600-telecom?cid=996843,EUR
switzerland,ch,996840.0,Lyxor UCITS Stoxx Europe 600 Oil & Gas,LYOIL,lyxor-stoxx-europe-600-oil---gas?cid=996840,EUR
switzerland,ch,996838.0,Lyxor UCITS Stoxx 50 Daily Leverage,LYLVE,lyxor-leveraged-euro-stoxx-50?cid=996838,EUR
switzerland,ch,996837.0,Lyxor UCITS Turkey (DJ Turkey Titans 20),LYTUR,lyxor-turkey---dj-turkey-titans-20?cid=996837,EUR
switzerland,ch,996835.0,Amundi ETF MSCI Europe UCITS,CEU,amundi-etf-msci-europe?cid=996835,EUR
switzerland,ch,996834.0,Amundi ETF MSCI China UCITS,CC1USD,amundi-etf-msci-china-usd?cid=996834,USD
switzerland,ch,996826.0,SPDR S&P UK Dividend Aristocrats,UKDV,spdr-s-p-uk-dividend-aristocrats?cid=996826,CHF
switzerland,ch,996824.0,Market Access DAXGlobal Asia,MDAI,rbs-market-access-dax-global-asia?cid=996824,USD
switzerland,ch,996849.0,SSgA SPDR S&P Emerging Markets Dividend,EMDV,spdr-s-p-emerging-mrktsdividend-uk?cid=996849,CHF
switzerland,ch,996816.0,UBS Irl ETF plc - MSCI USA UCITS USD A-dis,USAUSY,ubs-(irl)-plc---msci-usa-(usd)-a?cid=996816,USD
switzerland,ch,996815.0,PowerShares FTSE RAFI Emerging Markets UCITS,PSDE,powershares-dynamic-europe-fund?cid=996815,USD
switzerland,ch,996814.0,Source MSCI Emerging Markets UCITS,MXFS,msci-emerging-markets-source?cid=996814,USD
switzerland,ch,996810.0,HSBC MSCI EM Latin America UCITS,HMLA,hsbc-msci-em-latin-america?cid=996810,USD
switzerland,ch,996809.0,HSBC MSCI Japan UCITS,HMJP,hsbc-msci-japan?cid=996809,USD
switzerland,ch,996808.0,HSBC MSCI Japan UCITS,HMJPJPY,hsbc-msci-japan?cid=996808,JPY
switzerland,ch,996807.0,HSBC MSCI EUROPE UCITS,HMEU,hsbc-msci-europe?cid=996807,USD
switzerland,ch,996806.0,HSBC MSCI EUROPE UCITS,HMEUS,hsbc-msci-europe?cid=996806,EUR
switzerland,ch,996804.0,HSBC MSCI Brazil UCITS,HBRL,hsbc-msci-brazil?cid=996804,USD
switzerland,ch,996846.0,db x-trackers MSCI Korea UCITS DR,XKSI,db-xtrackers-msci-korea-trn-uk?cid=996846,USD
switzerland,ch,996852.0,db x-trackers MSCI Canada UCITS 1C,XCAN,db-xtrackers-msci-canada-trn-uk?cid=996852,CHF
switzerland,ch,996802.0,HSBC MSCI Canada UCITS,HCAN,hsbc-msci-canada?cid=996802,USD
switzerland,ch,996883.0,Source Technology S&P US Select Sector UCITS,XLKS,tech-s-p-us-sel-sector-source?cid=996883,USD
