country,country_code,id,name,symbol,tag,currency
germany,de,45842.0,iShares FTSE MIB UCITS Acc,SXRY,cs-etf-(ie)-on-ftse-mib?cid=45842,EUR
germany,de,46248.0,UBS (Irl) ETF plc - MSCI World UCITS USD A-dis,UBU7,ubs-plc-msci-world-(usd)-a-de,EUR
germany,de,45864.0,HSBC MSCI Japan,H4ZC,hsbc-msci-japan-de,EUR
germany,de,46349.0,ComStage STOXX Europe 600 Travel & Leisure NR UCIT,CBSXTR,comstage-stoxx600-travel--lei.-nr,EUR
germany,de,37558.0,iShares Euro Government Bond 3-5Yr UCITS,IBCN,ishares-euro-gov.-bond-3-5-it?cid=37558,EUR
germany,de,997714.0,db x-trackers FTSE 100 DR 1C,XDUK,db-xtrackers-ftse-100-dr-1c-de,EUR
germany,de,46415.0,db x-trackers STOXX Europe 600 Oil & Gas UCITS,XSER,db-xtrackers-stoxxeuro-600-oil-gas,EUR
germany,de,46219.0,SPDR MSCI Europe Consumer Staples UCITS,SPYC,spdr-msci-europe-consumer-staples?cid=46219,EUR
germany,de,38653.0,iShares $ Treasury Bond 3-7Yr UCITS Acc,SXRL,cs-etf-(ie)-on-iboxx-usd-govt-3-7,USD
germany,de,46165.0,Lyxor UCITS Stoxx Europe 600 Construction & Materi,LCST,lyxor-stoxx-euro-600-cons.---mat.?cid=46165,EUR
germany,de,46675.0,ComStage Commerzbank Bund-Future TR UCITS,CBBUND,comstagecommerzbank-bund-future-tr,EUR
germany,de,45830.0,Lyxor UCITS Daily Leveraged Bund,LYMI,lyxor-daily-leveraged-bund?cid=45830,EUR
germany,de,46064.0,ETFS 2x Daily Long Natural Gas,4RUC,etfs-leveraged-natural-gas-de,EUR
germany,de,46534.0,Source STOXX 600 Optimised Travel & Leisure,XTPS,stoxx600-opt.-travel--lei.-sou.,EUR
germany,de,46530.0,Source STOXX 600 Optimised Construction & Material,XOPS,stoxx600-opt.-cons.---mat.-source,EUR
germany,de,46342.0,ComStage STOXX Europe 600 Basic Resources NR UCITS,CBSXPR,comstage-stoxx600-basic-res.-nr,EUR
germany,de,46429.0,Deka iBoxx Liquid Corporates Diversified UCITS,ETFLCD,etflab-iboxx-€-liquid-corps-diver.,EUR
germany,de,46344.0,ComStage STOXX Europe 600 Financial Services NR UC,CBSXFR,comstage-stoxx600-fin.-ser.-nr,EUR
germany,de,46217.0,SPDR MSCI Europe Industrials UCITS,SPYQ,spdr-msci-europe-industrials?cid=46217,EUR
germany,de,46506.0,Market Access RICI Agriculture,MRAI,rbs-market-access-rici-agriculture,EUR
germany,de,46449.0,HSBC EURO STOXX 50,H4ZA,hsbc-euro-stoxx-50,EUR
germany,de,46320.0,ComStage MSCI Europe TRN UCITS,CBMINEU,comstage-msci-europe-trn,EUR
germany,de,46333.0,ComStage MSCI Pacific ex Japan TRN UCITS,CBMINAPJ,comstage-msci-pacific-x-japan-trn,EUR
germany,de,46339.0,ComStage STOXX Europe 600 Technology NR UCITS,CBSX8R,comstage-stoxx-europe-600-tech-nr,EUR
germany,de,46315.0,ComStage iBoxx EUR Liquid Sovereigns Diversified 7,CB3LD9,comstage-€-liquid-sov.-7-10-tr,EUR
germany,de,46328.0,ComStage MSCI EM Eastern Europe TRN UCITS,CBMINEE,comstage-msci-em-eastern-europetr,EUR
germany,de,45858.0,ETFS Grains,AIGR,etfs-grains-dj-ubsci-de,EUR
germany,de,46538.0,UBS ETFs plc - MSCI AC Asia Ex Japan SF UCITS USD,UIQI,ubss-msci-ac-asia-x-jap.-tr-usd-a,USD
germany,de,46224.0,ETFS Daily Short Wheat,4RTK,etfs-short-wheat-de,EUR
germany,de,38600.0,iShares Euro Government Bond 1-3Yr UCITS,IBCA,ishares-€-government-bond-1-3?cid=38600,EUR
germany,de,46078.0,PowerShares FTSE RAFI US 1000 UCITS,PSRF,powershares-ftse-rafi-us-1000-fund?cid=46078,EUR
germany,de,45973.0,Amundi ETF MSCI Europe High Dividend UCITS,EHF1,amundimsci-europe-high-dividend?cid=45973,EUR
germany,de,46292.0,ComStage ATX UCITS,CBATX,comstage-atx,EUR
germany,de,46167.0,Lyxor UCITS Stoxx Europe 600 Food & Beverage,LFOD,lyxor-stoxxeuro-600-food---bev.?cid=46167,EUR
germany,de,46828.0,UBS ETF Barclays Capital US 7-10Y Treasury Bond US,UEFI,ubs-etf-us-7-10-year-tr-bond-a-de,EUR
germany,de,46458.0,iShares Euro Government Bond 0-1Yr UCITS,EUN6,ishares-barclays-euro-tr.-bd-0-1?cid=46458,EUR
germany,de,46352.0,ComStage STOXX Europe 600 Oil & Gas NR UCITS,CBSXER,comstage-stoxxeuro-600-oil-gas-nr,EUR
germany,de,45942.0,db Brent Crude Oil Booster,XCTL,db-brent-crude-oil-booster-eur-de,EUR
germany,de,46347.0,ComStage STOXX Europe 600 Industrial Goods & Servi,CBSXNR,comstage-stoxx600-ind.-goods--ser.,EUR
germany,de,37489.0,db x-trackers MSCI Taiwan UCITS DR,XMTW,db-x-trackers-msci-taiwan-trn,EUR
germany,de,46176.0,Lyxor UCITS Stoxx Europe 600 Insurance,LIRU,lyxor-stoxx-europe-600-insurance?cid=46176,EUR
germany,de,46156.0,Lyxor UCITS MSCI Korea C-EUR,LKOG,lyxor-msci-korea?cid=46156,EUR
germany,de,46335.0,ComStage STOXX Europe 600 Telecom NR UCITS,CBSXKR,comstage-stoxx-euro-600-telecom-nr,EUR
germany,de,46351.0,ComStage STOXX Europe 600 Insurance NR UCITS,CBSXIR,comstage-stoxxeuro-600-insu.-nr,EUR
germany,de,46412.0,db x-trackers STOXX Europe 600 Tech UCITS,XS8R,db-x-trackers-stoxx-euro-600-tech,EUR
germany,de,46738.0,Deka MSCI Japan UCITS,ETFJPAC,etflab-msci-japan,EUR
germany,de,994146.0,iShares TA-25 Israel,QDVM,ishares-ta25-israel-ucits,EUR
germany,de,45967.0,Amundi ETF Stoxx Europe 600 UCITS,AME6,amundi-etf-stoxx-europe-600?cid=45967,EUR
germany,de,38641.0,SPDR FTSE UK All Share,SPYF,spdr-ftse-uk-all-share,EUR
germany,de,46765.0,Coba -2x Palladium Daily Short,X0BV,coba-etc--2x-palladium-daily-short,EUR
germany,de,46770.0,ComStage MSCI Russia 30 % Capped TRN UCITS,CBMINRUC,comstage-msci-russia-30-cappedtr,EUR
germany,de,46120.0,Lyxor UCITS Euro Corporate Bond ex Financials C-EU,LYBF,lyxor-euro-corp-bond-x-financials?cid=46120,EUR
germany,de,38656.0,iShares Euro Government Bond 7-10Yr UCITS Acc,SXRQ,cs-etf-(ie)-on-iboxx-eur-govt-7-10,EUR
germany,de,956314.0,Deka EURO STOXX 50,ELFA,deka-euro-stoxx-50,EUR
germany,de,46533.0,Source STOXX 600 Optimised Personal & Household Go,XQPS,stoxx600-opt.-per.--house.-goods,EUR
germany,de,46118.0,Amundi ETF Leveraged MSCI USA Daily UCITS,CL2,amundi-leveraged-msci-usa---eur?cid=46118,EUR
germany,de,46515.0,Source STOXX 600 Optimised Basic Resources,XPPS,stoxx-600-optimised-basic-res.,EUR
germany,de,37463.0,Coba 2x Platinum Daily Long,X0BI,coba-etc-2x-platinum-daily-long,EUR
germany,de,38655.0,iShares Euro Government Bond 3-7Yr UCITS Acc,SXRP,cs-etf-(ie)-on-iboxx-eur-govt-3-7,EUR
germany,de,46314.0,ComStage iBoxx EUR Liquid Sovereigns Diversified 5,CB3LD8,comstage-€-liquid-sov.-5-7-tr,EUR
germany,de,46785.0,ComStage MSCI Taiwan TRN UCITS,CBMINTW,comstage-msci-taiwan-trn,EUR
germany,de,1024396.0,SPDR Morningstar Multi-Asset Global,ZPRI,spdr-morningstar-multi-asset-global?cid=1024396,EUR
germany,de,46446.0,Source EURO STOXX 50 B Total Return,SDJE5D,euro-stoxx-50-distributing-source,EUR
germany,de,46571.0,ETFS Daily Short Crude Oil,9GA7,etfs-short-wti-crude-oil,EUR
germany,de,46124.0,ETFS Commodity Securities Cotton,OD7E,etfs-cotton-de,EUR
germany,de,45891.0,Source MSCI Japan UCITS,SMSJPN,msci-japan-source?cid=45891,EUR
germany,de,46250.0,UBS (Irl) ETF plc - S&P 500 UCITS USD A-dis,UBU9,ubs-(irl)-plc---s-p-500-(usd)-a-de,EUR
germany,de,46122.0,Lyxor MSCI World Consumer Discretionary TR UCITS C,LYXDISW,lyxor-msci-world-consumer-disc.-tr?cid=46122,EUR
germany,de,38603.0,iShares FTSEurofirst 100 UCITS,IQQ1,ishares-ftseurofirst-100---ie?cid=38603,EUR
germany,de,46501.0,Ossiam iSTOXX Europe Minimum Variance NR UCITS 1C,OSX4,ossiam-stoxx-eur-min-var-nr---gbp,EUR
germany,de,46432.0,Deka MSCI Europe MC UCITS,ETFEUMC,etflab-msci-europe-mc,EUR
germany,de,45968.0,Amundi ETF Govt Bond EuroMTS Broad Investment Grad,CB3G,amundi-gov-bond-mts-broad-invest?cid=45968,EUR
germany,de,46560.0,Coba -4x Copper Daily Short,X0DG,coba-etc--4x-copper-daily-short,EUR
germany,de,46137.0,Amundi MSCI USA UCITS,ACU2,amundi-msci-usa-de,EUR
germany,de,46424.0,Deka iBoxx Liquid Sovereign Diversified 5-7 UCITS,ETFES57,etflab-€-liquid-sov.-diver.-5-7,EUR
germany,de,46287.0,ComStage CAC 40 UCITS,CBFCHI,comstage-cac-40?cid=46287,EUR
germany,de,46220.0,SPDR MSCI Europe Telecom UCITS,SPYT,spdr-msci-europe-telecom-services?cid=46220,EUR
germany,de,46525.0,Source STOXX 600 Optimised Utilities,X6PS,stoxx-600-optimised-uti.,EUR
germany,de,949283.0,db x-trackers II iBoxx Japan Sovereign UCITS 1C,XJSE,db-x-trackers-ii-markit-iboxx-japan?cid=949283,EUR
germany,de,45798.0,ETFS Commodity Securities Aluminium,OD7A,etfs-aluminium-de,EUR
germany,de,46104.0,Lyxor UCITS Stoxx Europe 600 Automobiles & Parts,LAUT,lyxor-stoxxeuro-600-auto.---parts?cid=46104,EUR
germany,de,46531.0,Source STOXX 600 Optimised Food & Beverage,X3PS,stoxx600-opt.-food--bev.-source,EUR
germany,de,46727.0,db x-trackers FTSE MIB UCITS DR,XMIB,db-x-trackers-ftse-mib-index,EUR
germany,de,46664.0,ComStage iBoxx EUR Sovereigns Germany Capped 10+ T,CBIBOXSC0T,comstage-€-sov.-germany-cap-10-tr,EUR
germany,de,46803.0,ComStage MSCI USA Mid Cap TRN UCITS,CBMINUSM,comstage-msci-usa-mid-cap-trn,EUR
germany,de,46343.0,ComStage STOXX Europe 600 Construction & Materials,CBSXOR,comstage-stoxx600-cons.---mat.-nr,EUR
germany,de,46119.0,Amundi ETF MSCI Nordic UCITS,CN1G,amundi-msci-nordic?cid=46119,EUR
germany,de,46816.0,Deka MSCI USA MC UCITS,ETFUSMC,etflab-msci-usa-mc,EUR
germany,de,46172.0,Lyxor UCITS Stoxx Europe 600 Health Care,LHTC,lyxor-stoxx-europe-600-health-care?cid=46172,EUR
germany,de,46324.0,ComStage EURO STOXX 50 Daily Leverage UCITS,CBSX5EL,comstage-euro-stoxx-50-leverage,EUR
germany,de,46744.0,ComStage Commerzbank EONIA TR UCITS,CBEONIA,comstage-commerzbank-eonia-tr,EUR
germany,de,46317.0,ComStage Commerzbank FED Funds Effective Rate TR U,CBFEDFER,comstage-cbfeds-effective-rate-tr,EUR
germany,de,46663.0,ComStage iBoxx EUR Sovereigns Germany Capped 5-10,CBIBOXSC5T,comstage-€-sov.-ger.-cap-5-10-tr,EUR
germany,de,46330.0,ComStage MSCI Europe Mid Cap TRN UCITS,CBMINEUM,comstage-msci-europe-mid-cap-trn,EUR
germany,de,46201.0,ETFS Daily Daily Short Coffee,9GA3,etfs-short-coffee-de,EUR
germany,de,38635.0,iShares eb.rexx Government Germany 2.5-5.5,RXP2EX,ishares-eb.rexx-gov-ger.-2.5-5.5,EUR
germany,de,46553.0,Coba 1x Copper Daily Long,X0D9,coba-etc-1x-copper-daily-long,EUR
germany,de,46680.0,db x-trackers II iBoxx Germany UCITS 1D,XBTR,db-x-trackers-ii-€-germany-tr-1d,EUR
germany,de,38564.0,ComStage FTSE 100 TR UCITS,CBTFTSE,ftse-100-tr,EUR
germany,de,46178.0,Lyxor UCITS EuroMTS Highest Rated Macro-Weighted G,LYS5,lyxor-euromts-aaa-gov-3-5-y?cid=46178,EUR
germany,de,45948.0,Amundi S&P 500 EUR Hedged Daily UCITS,H1D5,amundi-s-p-500-eur-hedged-daily-de,EUR
germany,de,38661.0,SSgA SPDR Barclays Cap Sterling Corporate Bond,SYBS,spdr-barclays-sterling-corp-bnd-uk?cid=38661,EUR
germany,de,46662.0,ComStage iBoxx EUR Sovereigns Germany Capped 3m-2,CBIBOXSC3T,comstage-€-sov.-ger.-cap-3m-2-tr,EUR
germany,de,46207.0,ETFS Daily Short Lean Hogs,4RTB,etfs-short-lean-hogs-de,EUR
germany,de,46037.0,Amundi ETF Short Govt Bond EuroMTS Broad Investmen,S10,amundi-short-gov-bond-mts-10-15?cid=46037,EUR
germany,de,46109.0,Amundi CAC 40 UCITS,GC40,amundi-cac-40-de,EUR
germany,de,46125.0,Amundi ETF MSCI Pacific Ex Japan UCITS,CP9,amundi-msci-pacific-x-japan---eur?cid=46125,EUR
germany,de,46742.0,db x-trackers MSCI Malaysia UCITS DR 1C,XCS3,db-xtrackers-msci-malaysia-trn-uk?cid=46742,EUR
germany,de,38642.0,SPDR S&P UK Dividend Aristocrats,SPYG,spdr-s-p-uk-dividend-aristocrats,EUR
germany,de,46665.0,ComStage iBoxx EUR Sovereigns Germany Capped 1-5 T,CBIBOXSC1T,comstage-€-sov.-germany-cap-1-5-tr,EUR
germany,de,46337.0,ComStage STOXX Europe 600 Media NR UCITS,CBSXMR,comstage-stoxx-europe-600-media-nr,EUR
germany,de,998419.0,Boost ShortDAX 3x Daily,3DEO,boost-shortdax-3x-daily-de,EUR
germany,de,46340.0,ComStage STOXX Europe 600 Utilities NR UCITS,CBSX6R,comstage-stoxx-europe-600-uti.-nr,EUR
germany,de,46420.0,Deka iBoxx Liquid Sovereign Diversified 10+ UCITS,ETFES10,etflab-€-liquid-sov.-diver.-10,EUR
germany,de,46536.0,UBS ETF - EURO STOXX 50 UCITS EUR A-dis,E50EUA,ubs-etf-euro-stoxx-50,EUR
germany,de,46162.0,ETFS 2x Daily Long Live Cattle ETC,4RUB,etfs-leveraged-live-cattle-de,EUR
germany,de,46693.0,iShares Germany Government Bond UCITS,IS0L,ishares-barclays-germany-tr.-bond?cid=46693,EUR
germany,de,45979.0,Amundi ETF Euro Inflation UCITS,CI3,amundi-etf-euro-inflation?cid=45979,EUR
germany,de,46097.0,db x-trackers FTSE 250 UCITS DR,XMCX,db-x-trackers-ftse-250?cid=46097,EUR
germany,de,46678.0,db x-trackers II iBoxx Germany 1-3 UCITS 1D,XB13,db-x-trackers-ii-€-germany-1-3-tr,EUR
germany,de,46350.0,ComStage STOXX Europe 600 Chemicals NR UCITS,CBSX4R,comstage-stoxxeuro-600-chem.-nr,EUR
germany,de,37433.0,Deka Deutsche Boerse EUROGOV Germany 1-3 UCITS,ETFGS13,etflab-deutsche-borse-germany-1-3,EUR
germany,de,46463.0,iShares Emerging Asia Local Government Bond UCITS,IS0S,ishares-em-asia-local-gov-cap-bond,EUR
germany,de,46348.0,ComStage STOXX Europe 600 Personal & Household Goo,CBSXQR,comstage-stoxx600-per.-house.-nr,EUR
germany,de,46025.0,Lyxor UCITS MSCI World Materials TR C-EUR,LYXMATW,lyxor-msci-world-materials-tr?cid=46025,EUR
germany,de,46286.0,Lyxor UCITS iBoxx EUR Liquid High Yield 30 Ex-Fina,LYQY,lyxor-iboxx-eur-liq.-high-yield-30?cid=46286,EUR
germany,de,46524.0,Source STOXX 600 Optimised Telecommunications,XKPS,stoxx-600-optimised-telecom-source,EUR
germany,de,45994.0,Amundi ETF MSCI Europe Ex EMU UCITS,CU9,amundi-etf-msci-europe-x-emu?cid=45994,EUR
germany,de,46058.0,HSBC FTSE 100,H4ZB,hsbc-ftse-100-de,EUR
germany,de,46218.0,SPDR MSCI Europe Consumer Discretionary UCITS,SPYR,spdr-msci-europe-consumer-discr.?cid=46218,EUR
germany,de,46739.0,Deka MSCI Japan LC UCITS,ETFJPLC,etflab-msci-japan-lc,EUR
germany,de,46093.0,db x-trackers FTSE All-Share UCITS DR,XASX,db-x-trackers-ftse-all-share?cid=46093,EUR
germany,de,45824.0,Lyxor UCITS South Africa (FTSE JSE Top 40),LSAG,lyxor-south-africa-(ftse-jse)?cid=45824,EUR
germany,de,46456.0,iShares Euro Government Bond 5-7Yr UCITS,EUN9,ishares-euro-gov-bond-5-7-eur-uk?cid=46456,EUR
germany,de,46334.0,ComStage STOXX Europe 600 Retail NR UCITS,CBSXRR,comstage-stoxx-euro-600-retail-nr,EUR
germany,de,46290.0,db x-trackers II Australia SSA Bonds UCITS 1C,XCS2,australia-ssa-bonds-tr-index,EUR
germany,de,46145.0,Lyxor UCITS EuroMTS Covered Bond Aggregate,LCVB,lyxor-euromts-covered-bond-agg.?cid=46145,EUR
germany,de,46010.0,Lyxor UCITS MSCI World Industrials TR C-EUR,LYXINDW,lyxor-msci-world-industrials-tr?cid=46010,EUR
germany,de,46174.0,Lyxor UCITS Stoxx Europe 600 Personal & Household,LPHG,lyxor-stoxx600-per.--house.-goods?cid=46174,EUR
germany,de,46386.0,db x trackers II Eur Gov Bd 15+,X15E,db-xtrackers-ii-€-sov.-euro-15-tr,EUR
germany,de,38664.0,UBS ETF MSCI USA UCITS USD A-dis,USAEUA,ubs-etf-msci-usa,EUR
germany,de,45899.0,PowerShares Dynamic US Market UCITS,PSWC,powershares-dynamic-us-mrkt-it?cid=45899,EUR
germany,de,46431.0,Deka MSCI Europe LC UCITS,ETFEULC,etflab-msci-europe-lc,EUR
germany,de,46413.0,db x-trackers STOXX Europe 600 Utilities UCITS,XS6R,db-x-trackers-stoxx-euro-600-uti.,EUR
germany,de,46311.0,ComStage iBoxx EUR Liquid Sovereigns Diversified 2,CBIBOXS25T,comstage-€-liquid-sov.-25-tr,EUR
germany,de,46356.0,db x-trackers II iBoxx Liquid Corporate Non-Financ,XB4N,db-€-liq.-corp-100-non-fin.-tr,EUR
germany,de,46691.0,Deka iBoxx Liquid Germany Covered Diversified UCIT,ETFIBOXGC,etflab-eur-liq.-ger.-cov.-diver.,EUR
germany,de,46370.0,db x-trackers STOXX Europe 600 Industrial Goods UC,XSNR,db-stoxxeuro600-ind.-goods,EUR
germany,de,46815.0,Deka MSCI USA LC UCITS,ETFUSLC,etflab-msci-usa-lc,EUR
germany,de,46184.0,SPDR MSCI Europe Energy UCITS,SPYN,spdr-msci-europe-energy?cid=46184,EUR
germany,de,46029.0,Lyxor UCITS EuroMTS 3-5Y Investment Grade DR,LYQ3,lyxor-euromts-3-5y-invest-grade?cid=46029,EUR
germany,de,46376.0,db x-trackers II iBoxx Sovereigns Eurozone 3-5 UCI,X35E,db-xtrackers-€-sov.-euro-3-5-tr-1c,EUR
germany,de,38654.0,iShares $ Treasury Bond 7-10Yr UCITS Acc,SXRM,cs-etf-(ie)-on-iboxx-usd-govt-7-10,USD
germany,de,46551.0,Coba 4x Cocoa Daily Long,X0BC,coba-etc-4x-cocoa-daily-long,EUR
germany,de,46242.0,UBS ETF MSCI EMU Small Cap UCITS EUR A-dis,ESCEUA,ubs-etf-msci-emu-small-cap-a-de,EUR
germany,de,959564.0,Lyxor JP Morgan Multi-Factor Europe UCITS,LYX5,lyxor-jp-morgan-multi-factor-europe,EUR
germany,de,45922.0,SSgA SPDR Barclays Cap US Aggregate Bond,USAG,spdr-barclays-us-aggregate-bond?cid=45922,EUR
germany,de,38695.0,db x-trackers II Short iBoxx Sovereigns Eurozone U,XSGL,db-xtrackers-short-€-sov.-euro-tr,EUR
germany,de,46660.0,ComStage iBOXX EUR Germany Covered Capped Overall,CBIBOXGCA0,comstage-€-german-cov.-cap-oval-tr,EUR
germany,de,949560.0,db x-trackers II iBoxx Sovereigns Eurozone 3-5 UCI,X03C,db-xtrackers-€-sov.-euro-3-5-tr-1d?cid=949560,EUR
germany,de,45965.0,Amundi ETF Leveraged Euro Stoxx 50 Daily UCITS,C5L,amundi-leveraged-euro-stoxx-50?cid=45965,EUR
germany,de,46578.0,ETFS EUR Daily Hedged All Commodities,00XK,etfs-all-comm.-dj-ubs-eur-hedged,EUR
germany,de,46175.0,Lyxor UCITS Stoxx Europe 600 Travel & Leisure,LTVL,lyxor-stoxxeuro-600-travel--lei.?cid=46175,EUR
germany,de,46688.0,Deka Deutsche Boerse EUROGOV Germany 3-5 UCITS,ETFGS35,etflab-deutsche-borse-germany-3-5,EUR
germany,de,45944.0,db x-trackers II MTS Ex-Bank of Italy Aggregate UC,XBO3,db-mts-x-bank-of-italy-agg.-de,EUR
germany,de,46002.0,Amundi ETF Euro Stoxx Small Cap UCITS,ZESM,amundi-etf-euro-stoxx-smlcap?cid=46002,EUR
germany,de,46614.0,ETFS Long JPY,SJPS,etfs-long-jpy-short-eur,EUR
germany,de,45832.0,db x-trackers II MTS Ex-Bank of Italy BOT UCITS 1C,XBO2,db-mts-x-bank-of-italy-bot-de,EUR
germany,de,37592.0,db x-trackers II Sterling Cash UCITS,XSTR,db-x-trackers-ii-sterling-cash-etf,EUR
germany,de,46648.0,Coba 4x DAXF Daily Long,X00D,coba-4x-daxf-daily-long,EUR
germany,de,38630.0,Market Access RICI Metals,MRMI,rbs-market-access-rici-metals,EUR
germany,de,46308.0,ComStage iBoxx EUR Liquid Sovereigns Diversified 1,CBIBOXS10T,coms.-€-liq.-sov.-diver.-10-15-tr,EUR
germany,de,38688.0,db x-trackers II iBoxx Germany 3-5 UCITS,XGN5,db-xtrackers-ii-€-germany-3-5-tri,EUR
germany,de,46425.0,Deka iBoxx Liquid Sovereign Diversified 7-10 UCITS,ETFES71,etflab-€-liquid-sov.-diver.-7-10,EUR
germany,de,46689.0,Deka Deutsche Boerse EUROGOV Ger 5-10 UCITS,ETFGS51,etflab-deutsche-borse-germany-5-10,EUR
germany,de,994147.0,iShares Sust MSCI Japan SRI EUR Hdg,QDVN,ishares-sustainable-msci-japan-sri,EUR
germany,de,46310.0,ComStage iBoxx EUR Liquid Sovereigns Diversified 1,CBIBOXS15T,comstage-€-liquid-sov.-15-tr,EUR
germany,de,45797.0,ETFS Petroleum,OD72,etfs-petroleum-dj-ubsci-de,EUR
germany,de,1009024.0,ETFS 3x Daily Long EURO STOXX 50,EUL3,etfs-3x-daily-long-eurostx-50-de,EUR
germany,de,46499.0,Source MSCI Europe Value,EMSV,msci-europe-value-source,EUR
germany,de,1013317.0,RICI Enhanced Kupfer TR Hedge,B4N5,rici-enhanced-kupfer-tr-hedge,EUR
germany,de,38669.0,Coba 2x Palladium Daily Long,X0BR,coba-etc-2x-palladium-daily-long,EUR
germany,de,1009020.0,Boost EURO STOXX 50 3X Short Daily,PCFC,boost-euro-stoxx-50-3x-short-daily?cid=1009020,EUR
germany,de,38677.0,ETFS Long CAD Short EUR,XBJL,etfs-long-cad-short-eur,EUR
germany,de,38675.0,ETFS Long AUD Short EUR,XBJJ,etfs-long-aud-short-eur,EUR
germany,de,37480.0,Coba 2x HSCEIF Daily Long,X0CB,coba-etn-2x-hsceif-daily-long,EUR
germany,de,1009019.0,Boost EURO STOXX 50 3x Leverage Daily,PCFD,boost-eurostx-50-3x-lev-day-de,EUR
germany,de,37575.0,ETFS All Commodities,OD7V,etfs-all-commodities-dj-ubsci-de,EUR
germany,de,1024389.0,SPDR BofA Merrill Lynch 0-5 EM Govt Bond,ZPR5,spdrbofa-merrilllynch-0-5-em-govtbd?cid=1024389,EUR
germany,de,38672.0,ETFS Long CHF Short EUR,XBJA,etfs-long-chf-short-eur,EUR
germany,de,38648.0,iShares MSCI UK Small Cap UCITS,SXRD,cs-etf-(ie)-on-msci-uk-small-cap,EUR
germany,de,956311.0,iShares US Equity Buyback Achievers,CEM2,ishares-us-equity-buyback?cid=956311,EUR
germany,de,38613.0,iShares EURO Total Market Value Large UCITS,IQQV,ishares-dj-euro-stoxx-value?cid=38613,EUR
germany,de,995625.0,iShares MSCI Europe Size Factor,CEMT,ishares-msci-europe-size-factor?cid=995625,EUR
germany,de,1024373.0,First Trust Germany AlphaDEX,FTG1,first-trust-germany-alphadex,EUR
germany,de,994131.0,iShares MSCI EMU Large Cap UCITS,IS3G,ishares-msci-emu-large-cap?cid=994131,EUR
germany,de,38668.0,Coba 1x Cocoa Daily Long,X0B9,coba-etc-1x-cocoa-daily-long,EUR
germany,de,995624.0,iShares MSCI Europe Quality DE,CEMQ,ishares-msci-europe-quality-de?cid=995624,EUR
germany,de,37459.0,ETFS Longer Dated Industrial Metals,OD79,etfs-forward-ind.-metals-dj-ubsci,EUR
germany,de,46773.0,Coba -3x Silber Daily Short,X0CP,coba-etc--3x-silber-daily-short,EUR
germany,de,956318.0,WisdomTree Europe Equity,WTDH,wisdomtree-europe-equity,EUR
germany,de,46775.0,Coba -4x Silber Daily Short,X0CQ,coba-etc--4x-silber-daily-short,EUR
germany,de,46774.0,Coba 4x Silber Daily Long,X0CN,coba-etc-4x-silber-daily-long,EUR
germany,de,38659.0,SSgA SPDR Barclays Capital UK Gilt,SYBG,spdr-barclays-capital-uk-gilt-uk?cid=38659,EUR
germany,de,949279.0,UBS ETF - SBI Foreign AAA-BBB 5-10 UCITSCHF A-dis,UEFZ,ubs-sbi-foreign-aaa-bbb-5-10y-mi?cid=949279,EUR
germany,de,949278.0,UBS ETF - SBI Foreign AAA-BBB 1-5 UCITS CHF A-dis,UEFY,ubs-sbi-foreign-aaa-bbb-1-5y-mi?cid=949278,EUR
germany,de,1013328.0,RICI Enhanced Zinn TR Hedge,B4N8,rici-enhanced-zinn-tr-hedge,EUR
germany,de,38685.0,db x-trackers II EONIA UCITS 1D,XEOD,db-xtrackers-ii-eonia-tr-index-1d,EUR
germany,de,1013298.0,RICI Enhanced Brent Oil TR Hedge,BNQX,rici-enhanced-brent-oil-tr-hedge,EUR
germany,de,1013297.0,RICI Enhanced Aluminium TR Hedge,B4N4,rici-enhanced-aluminium-tr-hedge,EUR
germany,de,1009028.0,Source STOXX Eurozone Exporters,EZEX,source-stoxx-eurozone-exporters?cid=1009028,EUR
germany,de,45719.0,ETFS Soybean Oil,OD7P,etfs-soybean-oil-de,EUR
germany,de,44514.0,iShares Euro Government Bond 10-15yr,EUN8,ishares-euro-gov-bond-10-15-as?cid=44514,EUR
germany,de,46823.0,Ossiam US Minimum Variance NR UCITS 1C,OSX2,ossiamus-minimum-variance-nr,EUR
germany,de,46830.0,ETFS Long INR Short USD,XBJG,etfs-long-inr-short-usd,EUR
germany,de,47108.0,ETFS Daily Short Soybean Oil,4RTG,etfs-short-soybean-oil-de,EUR
germany,de,45800.0,ETFS Industrial Metals,OD7Z,etfs-industrial-metals-dj-ubsci-de,EUR
germany,de,38701.0,db x-trackers STOXX Europe 600 Telecom UCITS,XSKR,dj-stoxx600-telecommunications,EUR
germany,de,949272.0,UBS (Irl) ETF plc - MSCI EMU Defensive UCITS EUR A,UBUP,ubs-(irl)-msci-emu-defensive,EUR
germany,de,46800.0,Coba 4x SPXF Daily Long,X0DM,coba-4x-spxf-daily-long,EUR
germany,de,1013318.0,RICI Enhanced Nickel TR Hedge,B4N6,rici-enhanced-nickel-tr-hedge,EUR
germany,de,46798.0,Coba 4x NDXF Daily Long,X0DR,coba-4x-ndxf-daily-long,EUR
germany,de,46797.0,Coba -4x DJIAF Daily Short,X0DK,coba--4x-djiaf-daily-short,EUR
germany,de,46796.0,Coba 4x DJIAF Daily Long,X0DI,coba-4x-djiaf-daily-long,EUR
germany,de,46795.0,Coba -3x SPXF Daily Short,X0DN,coba--3x-spxf-daily-short,EUR
germany,de,46794.0,Coba 3x SPXF Daily Long,X0DL,coba-3x-spxf-daily-long,EUR
germany,de,46793.0,Coba -3x NDXF Daily Short,X0DS,coba--3x-ndxf-daily-short,EUR
germany,de,46791.0,Coba -3x DJIAF Daily Short,X0DJ,coba--3x-djiaf-daily-short,EUR
germany,de,1013326.0,RICI Enhanced Blei TR Hedge,B4N9,rici-enhanced-blei-tr-hedge,EUR
germany,de,1013327.0,RICI Enhanced Zink TR Hedge,B4N7,rici-enhanced-zink-tr-hedge,EUR
germany,de,46790.0,Coba 3x DJIAF Daily Long,X0DH,coba-3x-djiaf-daily-long,EUR
germany,de,46787.0,SPDR Barclays Capital 1-5 Year Gilt,SYB5,spdr-barclays-1-5-year-gilt,EUR
germany,de,37593.0,Coba -10x BUNDF Daily Short,X0CV,coba-etn--10x-bundf-daily-short,EUR
germany,de,46546.0,Coba -1x Cocoa Daily Short,X0BD,coba-etc--1x-cocoa-daily-short,EUR
germany,de,46772.0,Coba 3x Silber Daily Long,X0CM,coba-etc-3x-silber-daily-long,EUR
germany,de,46313.0,ComStage iBoxx EUR Liquid Sovereigns Diversified 3,CBIBOXSD3T,comstage-€-liquid-sov.-3m-1-tr,EUR
germany,de,45960.0,Amundi ETF Govt Bond EuroMTS Broad Investment Grad,C10,amundi-gov-bond-mts-invest-10-15?cid=45960,EUR
germany,de,45961.0,Amundi ETF Govt Bond EuroMTS Broad Investment Grad,C33,amundi-gov-bond-mts-invest-3-5?cid=45961,EUR
germany,de,46373.0,db x trackers II Eur Gov Bd 10 15,X105,db-xtrackers-€-sov.-euro-10-15-tr,EUR
germany,de,45962.0,Amundi ETF Cash 3 Months EuroMTS Investment Grade,18M1,amundi-cash-3-months-mts-invest?cid=45962,EUR
germany,de,45964.0,Amundi ETF Govt Bond EuroMTS Broad Investment Grad,C53,amundi-gov-bond-mts-nvest-5-7?cid=45964,EUR
germany,de,45966.0,Amundi ETF Short Euro Stoxx 50 Daily UCITS,C5S,amundi-short-euro-stoxx-50-daily?cid=45966,EUR
germany,de,45969.0,Amundi MSCI Europe Banks UCITS,CB5,amundi-msci-europe-banks-de,EUR
germany,de,46312.0,ComStage iBoxx EUR Liquid Sovereigns Diversified 3,CB3LD7,comstage-€-liquid-sov.-3-5-tr,EUR
germany,de,45955.0,Amundi ETF MSCI Europe Energy UCITS,AMEE,amundi-etf-msci-europe-energy?cid=45955,EUR
germany,de,46307.0,Coba -4x SX5EF Daily Short,X0CH,coba--4x-sx5ef-daily-short,EUR
germany,de,46305.0,Coba -3x SX5EF Daily Short,X0CG,coba--3x-sx5ef-daily-short,EUR
germany,de,46304.0,Coba 3x SX5EF Daily Long,X0CE,coba-3x-sx5ef-daily-long,EUR
germany,de,46303.0,Coba -4x Brent Oil Daily Short,X0D4,coba-etc--4x-brent-oil-daily-short,EUR
germany,de,46301.0,Coba -3x Brent Oil Daily Short,X0D3,coba-etc--3x-brent-oil-daily-short,EUR
germany,de,45971.0,Amundi ETF MSCI Europe Consumer Discretionary UCIT,CD6G,amundi-etf-msci-europe-cons.-disc?cid=45971,EUR
germany,de,46282.0,db Energy Booster Euro Hedged,XCTH,db-energy-booster-euro-hdg-etc-de,EUR
germany,de,45977.0,Amundi ETF MSCI Europe Healthcare UCITS,CH5,amundi-etf-msci-europe-healthcare?cid=45977,EUR
germany,de,45958.0,Amundi ETF Euro Corporate Ex Financials iBoxx UCIT,AFIX,amundi-euro-corp-x-fin.-iboxx?cid=45958,EUR
germany,de,45954.0,Amundi ETF Govt Bond Highest Rated EuroMTS Investm,DE5A,amundi-gov-bond-high-rate-mts-inv.?cid=45954,EUR
germany,de,45982.0,Amundi ETF MSCI Europe Industrials UCITS,CIN,amundi-etf-msci-europe-industrials?cid=45982,EUR
germany,de,45909.0,UBS-ETF FTSE 100 I,UEFS,ubs-etf-ftse-100-i-de,EUR
germany,de,45865.0,HSBC MSCI USA UCITS,H4ZD,hsbc-msci-usa-de,EUR
germany,de,45883.0,ETFS 2x Daily Long Platinum ETC,4RUM,etfs-leve.-platinum-dj-ubsci-de,EUR
germany,de,45893.0,PowerShares FTSE RAFI Europe Mid-Small UCITS,PSES,powershares-ftse-rafi-eu-mid-small?cid=45893,EUR
germany,de,45900.0,ETFS Short CNY Long USD,XBJF,etfs-short-cny-long-usd-de,EUR
