country,country_code,id,name,symbol,tag,currency
italy,it,45903.0,ETFS Short Livestock DJ UBSCI,SLST,etfs-short-livestock-dj-ubsci-de,EUR
italy,it,47104.0,ETFS Short Brent Crude,SBRT,etfs-short-brent-crude?cid=47104,EUR
italy,it,46084.0,ETFS Short Precious Metals DJ UBSCI,SPMT,etfs-short-pre.-metals-dj-ubsci-de,EUR
italy,it,46860.0,db x-trackers MSCI Taiwan UCITS DR,XMTW,db-x-trackers-msci-taiwan-trn?cid=46860,EUR
italy,it,46868.0,iShares MSCI UK UCITS,CSUK,cs-etf-(ie)-on-msci-uk?cid=46868,EUR
italy,it,46934.0,ETFS Lead,LEAD,etfs-lead?cid=46934,EUR
italy,it,46945.0,ETFS Short Natural Gas,SNGA,etfs-short-natural-gas?cid=46945,EUR
italy,it,46953.0,ETFS Short Copper,SCOP,etfs-short-copper-it,EUR
italy,it,46969.0,UBS ETF MSCI USA UCITS USD A-dis,USAEUA,ubs-etf-msci-usa?cid=46969,EUR
italy,it,46978.0,db x-trackers II Short iBoxx Sovereigns Eurozone U,XSGL,db-xtrackers-short-€-sov.-euro-tr?cid=46978,EUR
italy,it,46996.0,Amundi ETF Leveraged Euro Stoxx 50 Daily UCITS,C5L,amundi-leveraged-euro-stoxx-50?cid=46996,EUR
italy,it,47015.0,Amundi ETF MSCI Spain UCITS,CS1,amundi-etf-msci-spain?cid=47015,EUR
italy,it,47045.0,Lyxor UCITS Stoxx Europe 600 Retail,RTA,lyxor-stoxx-europe-600-retail?cid=47045,EUR
italy,it,47103.0,PowerShares FTSE RAFI US 1000 UCITS,PSRF,powershares-ftse-rafi-us-1000-fund?cid=47103,EUR
italy,it,949386.0,Source Russell 2000 UCITS,SR2000,source-russell-2000?cid=949386,EUR
italy,it,949409.0,iShares MSCI EMU Large Cap UCITS,EMUL,ishares-msci-emu-large-cap?cid=949409,EUR
italy,it,1072060.0,JPMorgan Ireland ICAV - Equity Long-Short UCITS ET,JELS,jpmorganieicaveq-longshort-usd,EUR
italy,it,1009159.0,PowerShares EURO STOXX High Dividend Low Volatilit,EUHD,powshr-euro-stoxx-highdiv-lowvol-f?cid=1009159,EUR
italy,it,951561.0,ETFS Short Tin,STIM,etfs-short-tin-de?cid=951561,EUR
italy,it,951563.0,SG EURO STOXX 50 -3x Daily Short Collateralized,SX5E3S,sg-eustoxx-50--3x-daily-short-coll,EUR
italy,it,951569.0,db Energy Booster Euro Hedged,XCTH,db-energy-booster-euro-hdg-etc-de?cid=951569,EUR
italy,it,956345.0,Ossiam Shiller Barclays Cape UK,CAPE,ossiam-shiller-barclays-cape-uk?cid=956345,EUR
italy,it,956347.0,ETFS Short Grains DJ UBSCI,SGRA,etfs-short-grains-dj-ubsci-de?cid=956347,EUR
italy,it,956348.0,ETFS Short Industrial Metals DJ,SIMT,etfs-short-industrial-metals-dj,EUR
italy,it,956365.0,Boost Brent Oil,BRND,boost-brent-oil,EUR
italy,it,956371.0,WisdomTree Japan Equity UK,DXJ,wisdomtree-japan-equity-uk?cid=956371,EUR
italy,it,994153.0,Boost FTSE MIB Banks,ITBL,boost-ftse-mib-banks,EUR
italy,it,995360.0,WisdomTree US SmallCap Dividend EUR,DESE,wisdomtree-us-smallcap-divid,EUR
italy,it,1009154.0,Amundi ETF Euro Stoxx Small Cap UCITS,ESM,amundi-etf-euro-stoxx-smlcap?cid=1009154,EUR
italy,it,1011900.0,Lyxor iBoxx $ Treasuries 10+ DR Monthly Hedged D-E,U10H,lyxor-iboxx-t-10-dr-monthly-hdgd,EUR
italy,it,951558.0,ETFS Short Nickel,SNIK,etfs-short-nickel-mi,EUR
italy,it,1011914.0,db x-trackers II iBoxx $ Treasuries DR 2D,XUTE,db-xtrack-ii-iboxx-tres-dr-2d,EUR
italy,it,1024443.0,Wisdomtree Europe Equity UK,HEDJ,wisdomtree-europe-equity-uk?cid=1024443,EUR
italy,it,1024475.0,Boost Bund 10Y 5x Short Daily,5BUS,boost-bund-10y-5x-short-daily,EUR
italy,it,1024476.0,Boost Long USD Short EUR 4x Daily,4USE,boost-long-usd-short-eur-4x-daily,EUR
italy,it,1024579.0,ETFS Short GBP Long EUR,GBEU,etfs-short-gbp-long-eur-mi,EUR
italy,it,1024585.0,ETFS EUR Daily Hedged Corn,ECRN,etfs-eur-daily-hedged-corn,EUR
italy,it,1024600.0,ETFS 3x Daily Short Copper,3CUS,etfs-3x-daily-short-copper,EUR
italy,it,1045779.0,UBS Bloomberg Barclays US Liquid Corporates Intere,CBUSIH,ubs-bb-us-liquid-corp-int,EUR
italy,it,1052290.0,db x-trackers iBoxx USD EM Sovereigns Quality Weig,XQUE,db-xtrackers-iboxx-usd-em-sover,EUR
italy,it,1056432.0,Source STOXX Europe Mid 200 UCITS,PSSMID,stoxx-mid-200-source?cid=1056432,EUR
italy,it,1056433.0,Boost Bund 30Y 3X Short Daily,3UBS,boost-bund-30y-3x-short-daily,EUR
italy,it,951559.0,ETFS Short Aluminium,SSALU,etfs-short-aluminium,EUR
italy,it,951556.0,ETFS Short Lead,SLEA,etfs-short-lead-de?cid=951556,EUR
italy,it,949425.0,SPDR MSCI Europe Consumer Staples UCITS,STSX,spdr-msci-europe-consumer-staples?cid=949425,EUR
italy,it,951508.0,ETFS EUR Daily Hedged Industrial Metals,EIMT,etfs-eur-daily-hedged-ind-metals,EUR
italy,it,949429.0,SPDR MSCI Europe Industrials UCITS,STQX,spdr-msci-europe-industrials?cid=949429,EUR
italy,it,949441.0,UBS - FTSE 100 UCITS GBP A-dis,100EUA,ubs-etf-ftse-100?cid=949441,EUR
italy,it,949467.0,db x-trackers II iBoxx Germany UCITS 1D,XBTR,db-x-trackers-ii-€-germany-tr-1d?cid=949467,EUR
italy,it,949507.0,UBS ETF - SBI Foreign AAA-BBB 1-5 UCITS CHF A-dis,SF1EUA,ubs-sbi-foreign-aaa-bbb-1-5y-mi,EUR
italy,it,949508.0,UBS ETF - SBI Foreign AAA-BBB 5-10 UCITSCHF A-dis,SF5EUA,ubs-sbi-foreign-aaa-bbb-5-10y-mi,EUR
italy,it,949557.0,db x trackers II Eur Gov Bd 10 15,X105,db-xtrackers-€-sov.-euro-10-15-tr?cid=949557,EUR
italy,it,951492.0,Boost Silver 2X Short Daily,2SIS,boost-silver-2x-short-daily,EUR
italy,it,951494.0,ETFS Livestock,AIGL,etfs-livestock-dj-aigci-pa?cid=951494,EUR
italy,it,951497.0,ETFS Short CHF Long EUR,CHEU,etfs-short-chf-long-eur-mi,EUR
italy,it,951505.0,ETFS Short Cotton,ECSCTO,etfs-short-cotton,EUR
italy,it,951507.0,ETFS 5x Long GBP Short EUR,EGB5,etfs-5x-long-usd-short-eur,EUR
italy,it,951509.0,ETFS 5x Long JPY Short EUR,EJP5,etfs-5x-short-usd-long-eur,EUR
italy,it,951555.0,ETFS Short Heating Oil,SHEA,etfs-short-heating-oil,EUR
italy,it,951516.0,ETFS Long USD Short EUR,EUUS,etfs-long-usd-short-eur-mi,EUR
italy,it,951526.0,SG Gold Collateralized,GOLD1L,sg-gold-collateralized,EUR
italy,it,951532.0,ETFS Leveraged Agriculture,LAGR,etfs-leveraged-agri.-dj-aigci?cid=951532,EUR
italy,it,951536.0,ETFS Leveraged Industrial Metal DJ UBSCI ETC,LIME,etfs-leveraged-industrial-metal,EUR
italy,it,951537.0,ETFS Leveraged Lead ETC,LLEA,etfs-leveraged-lead?cid=951537,EUR
italy,it,951539.0,ETFS Leveraged Energy DJ UBSCI ETC,LNRG,etfs-leveraged-energy-dj-aigci?cid=951539,EUR
italy,it,951541.0,ETFS Leveraged Precious Metals DJ UBSCI ETC,LPMT,etfs-leveraged-precious-metals,EUR
italy,it,951546.0,ETFS Short NOK Long EUR,NOEU,etfs-short-nok-long-eur-mi,EUR
italy,it,951547.0,ETFS Short NZD Long EUR,NZEU,etfs-short-nzd-long-eur-mi,EUR
italy,it,951551.0,ETFS WTI 2Mth,OILW,etfs-wti-2mth-oil?cid=951551,EUR
italy,it,951552.0,ETFS Short All Commodities DJ UBSCI,SALL,etfs-short-all-comm.-dj-ubsci-de?cid=951552,EUR
italy,it,951553.0,ETFS Short SEK Long EUR,SEEU,etfs-short-sek-long-eur-mi,EUR
italy,it,1138478.0,SPDR ICE BofAML 0-5 Year EM USD Government Bond UC,SPEMHE,spdr-ice-bofaml-05y-em-gov-bd,EUR
japan,jp,953289.0,NEXT FUNDS Nikkei 225 Double Inverse,1357,next-funds-nikkei-225-double-invers,JPY
japan,jp,953222.0,ETFS Natural Gas,1689,etfs-natural-gas?cid=953222,JPY
japan,jp,953291.0,NEXT FUNDS Nikkei 225 Leveraged,1570,next-funds-nikkei-225-leveraged,JPY
japan,jp,953341.0,Nomura TOPIX Listed,1306,nomura-topix-listed,JPY
japan,jp,953354.0,Simplex Nikkei 225 Bear -2x,1360,simplex-nikkei-225-bear-2x,JPY
japan,jp,953290.0,NEXT FUNDS Nikkei 225 Inverse,1571,next-funds-nikkei-225-inverse,JPY
japan,jp,953342.0,Nomura TSE Bank Listed,1615,nomura-tse-bank-listed,JPY
japan,jp,953337.0,Nomura Nikkei 225 Listed,1321,nomura-nikkei-225-listed,JPY
japan,jp,953327.0,NEXT NOTES Nikkei-TOCOM Leveraged Crude Oil,2038,next-notes-nikkei-tocom-leveraged-c,JPY
japan,jp,962256.0,Rakuten Nikkei 225 Double Inverse,1459,rakuten-nikkei-225-double-inverse,JPY
japan,jp,953293.0,NEXT FUNDS Nomura Crude Oil Long,1699,next-funds-nomura-crude-oil-long,JPY
japan,jp,953198.0,Daiwa ETF TOPIX Listed,1305,daiwa-etf-topix-listed,JPY
japan,jp,953355.0,Simplex Nikkei 225 Bull 2x,1579,simplex-nikkei-225-bull-2x,JPY
japan,jp,953190.0,Daiwa ETF Japan Nikkei 225 Double Inverse,1366,daiwa-etf-japan-nikkei-225-double-i,JPY
japan,jp,953359.0,Simplex TOPIX Bear -2x,1356,simplex-topix-bear-2x,JPY
japan,jp,953274.0,MAXIS TOPIX,1348,maxis-topix,JPY
japan,jp,953248.0,KOKUSAI S&P500 VIX Short-Term Futures,1552,kokusai-sp500-vix-short-term-futur,JPY
japan,jp,962257.0,Rakuten Nikkei 225 Leveraged,1458,rakuten-nikkei-225-leveraged,JPY
japan,jp,953335.0,Nikko TOPIX Listed,1308,nikko-topix-listed,JPY
japan,jp,962240.0,BRJ iShares TOPIX,1475,brj-ishares-topix,JPY
japan,jp,953191.0,Daiwa ETF Japan Nikkei 225 Leveraged,1365,daiwa-etf-japan-nikkei-225-leverage,JPY
japan,jp,953277.0,Mitsubishi Japan Physical Gold,1540,mitsubishi-japan-physical-gold,JPY
japan,jp,953295.0,NEXT FUNDS REIT,1343,next-funds-reit,JPY
japan,jp,953360.0,Simplex TOPIX Bull 2x,1568,simplex-topix-bull-2x,JPY
japan,jp,1052298.0,iShares S&P 500,1655,ishares-s-p-500-t,JPY
japan,jp,953282.0,NEXT FUNDS CNX Nifty Linked,1678,next-funds-cnx-nifty-linked,JPY
japan,jp,953240.0,iShares Nikkei 225,1329,ishares-nikkei-225-jp,JPY
japan,jp,1062629.0,TSE Mothers,2516,tse-mothers,JPY
japan,jp,953353.0,Simplex Nikkei 225 Bear -1x,1580,simplex-nikkei-225-bear-1x,JPY
japan,jp,953334.0,Nikko Nikkei 225 Listed,1330,nikko-nikkei-225-listed,JPY
japan,jp,953195.0,Daiwa ETF Nikkei 225 Listed,1320,daiwa-etf-nikkei-225-listed,JPY
japan,jp,953362.0,Simplex WTI,1671,simplex-wti,JPY
japan,jp,953317.0,NEXT NOTES DJIA Total Return JPY Monthly Hedged In,2041,next-notes-djia-total-return-jpy-mo,JPY
japan,jp,1090664.0,Nikko Listed IDX Fund US Equity S&P500 Hedged,2521,nikko-listed-idx-us-eq-sp500-hdgd,JPY
japan,jp,953272.0,MAXIS Nikkei 225,1346,maxis-nikkei-225,JPY
japan,jp,953279.0,Mitsubishi Japan Physical Platinum,1541,mitsubishi-japan-physical-platinum,JPY
japan,jp,953259.0,Listed Index Fund JPX-Nikkei 400,1592,listed-index-fund-jpx-nikkei-400,JPY
japan,jp,953219.0,ETFS Corn,1696,etfs-corn?cid=953219,JPY
japan,jp,962247.0,DIAM TOPIX,1473,diam-topix,JPY
japan,jp,953224.0,ETFS Wheat,1695,etfs-wheat?cid=953224,JPY
japan,jp,953297.0,NEXT FUNDS Russia RTS Linked,1324,next-funds-russia-rts-linked,JPY
japan,jp,956418.0,Daiwa Japan Nikkei225 Inverse,1456,daiwa-japan-nikkei225-inverse,JPY
japan,jp,953260.0,Listed Index Fund J-REIT,1345,listed-index-fund-j-reit,JPY
japan,jp,953324.0,Next Notes Nikkei 225 VI Futures,2035,next-notes-nikkei-225-vi-futures,JPY
japan,jp,956416.0,SMAM REIT,1398,smam-reit,JPY
japan,jp,953333.0,Nikko Listed Index Fund Nikkei Leveraged,1358,nikko-listed-index-fund-nikkei-leve,JPY
japan,jp,953192.0,Daiwa ETF Japan TOPIX Double Inverse (-2x),1368,daiwa-etf-japan-topix-double-invers,JPY
japan,jp,953267.0,Listed Index Fund US Equity (S&P500),1547,listed-index-fund-us-equity-sp500,JPY
japan,jp,953271.0,MAXIS J-REIT,1597,maxis-j-reit,JPY
japan,jp,953256.0,Listed Index Fund International Emerging Countries,1681,listed-index-fund-international-eme,JPY
japan,jp,953288.0,NEXT FUNDS NASDAQ 100,1545,next-funds-nasdaq-100,JPY
japan,jp,953363.0,SPDR Gold Shares,1326,spdr-gold-trust?cid=953363,JPY
japan,jp,1057103.0,NEXT FUNDS International Bond Citi World Governmen,2512,next-funds-citi-wrld-bd-exjpn-hdg,JPY
japan,jp,953286.0,NEXT FUNDS Ibovespa Linked,1325,next-funds-ibovespa-linked,JPY
japan,jp,953336.0,Nomura Gold Price Linked,1328,nomura-gold-price-linked,JPY
japan,jp,953332.0,NEXT NOTES Tokyo Stock Exchange Mothers,2042,next-notes-tokyo-stock-exchange-mot,JPY
japan,jp,953344.0,NZAM ETF J-REIT,1595,nzam-etf-j-reit,JPY
japan,jp,953364.0,SPDR S&P 500,1557,spdr-s-p-500?cid=953364,JPY
japan,jp,953361.0,Simplex TSE Mothers Core,1563,simplex-tse-mothers-core,JPY
japan,jp,962238.0,BRJ iShares MSCI Japan High Dividen,1478,brj-ishares-msci-japan-high-dividen,JPY
japan,jp,953214.0,Daiwa ETF TSE Bank Listed,1612,daiwa-etf-tse-bank-listed,JPY
japan,jp,1057104.0,NEXT FUNDS International REIT S&P Developed REIT I,2515,next-funds-reit-sp-ex-japan-unhdg,JPY
japan,jp,953325.0,NEXT NOTES Nikkei-TOCOM Inverse Crude Oil,2039,next-notes-nikkei-tocom-inverse-cru,JPY
japan,jp,953255.0,Listed Index Fund International Developed Countrie,1680,listed-index-fund-international-dev,JPY
japan,jp,953283.0,NEXT FUNDS Dow Jones Industrial Average,1546,next-funds-dow-jones-industrial-ave,JPY
japan,jp,1112800.0,BRJ iShares Automation & Robot,2522,brj-ishares-automation-robot,JPY
japan,jp,953358.0,Simplex TOPIX Bear -1x,1569,simplex-topix-bear-1x,JPY
japan,jp,1057100.0,NEXT FUNDS International Bond Citi World Governmen,2511,next-funds-citi-wrld-bd-exjpn-unhdg,JPY
japan,jp,1052300.0,iShares Core MSCI Kokusai,1657,ishares-core-msci-kokusai,JPY
japan,jp,1052299.0,iShares Core 7-10 US Treasury Bond,1656,ishares-core-7-10-us-treasury-bond,JPY
japan,jp,953193.0,Daiwa ETF Japan TOPIX Leveraged (2x),1367,daiwa-etf-japan-topix-leveraged-2x,JPY
japan,jp,953194.0,Daiwa ETF JPX-Nikkei 400,1599,daiwa-etf-jpx-nikkei-400,JPY
japan,jp,953338.0,Nomura Nikkei 300 Listed,1319,nomura-nikkei-300-listed,JPY
japan,jp,953268.0,Listed Index Fund World Equity (MSCI ACWI) ex Japa,1554,listed-index-fund-world-equity-msc,JPY
japan,jp,953269.0,MAXIS Global Equity (MSCI Kokusai),1550,maxis-global-equity-msci-kokusai,JPY
japan,jp,962237.0,BRJ iShares Japan REIT,1476,brj-ishares-japan-reit,JPY
japan,jp,953316.0,NEXT NOTES DJIA Price Return JPY Monthly Hedged Le,2040,next-notes-djia-price-return-jpy-mo,JPY
japan,jp,953287.0,NEXT FUNDS JPX-Nikkei 400,1591,next-funds-jpx-nikkei-400,JPY
japan,jp,1052301.0,iShares Core MSCI EM IMI,1658,ishares-core-msci-em-im,JPY
japan,jp,962251.0,Nikko Australia REIT,1555,nikko-australia-reit,JPY
japan,jp,1089277.0,NEXT FUNDS Emerging Market Bond J.P. Morgan EMBI P,2519,nf-em-bd-jpmorgan-embi-plus-unhdgd,JPY
japan,jp,962241.0,Daiwa Japan JPX Nikkei 400 Dbl Inv,1466,daiwa-japan-jpx-nikkei-400-dbl-inv,JPY
japan,jp,1052302.0,iShares US REIT,1659,ishares-us-reit,JPY
japan,jp,953340.0,Nomura TOPIX Core30 Listed,1311,nomura-topix-core30-listed,JPY
japan,jp,1052297.0,Daiwa FTSE Blossom Japan,1654,daiwa-ftse-blossom-japan,JPY
japan,jp,953292.0,NEXT FUNDS Nikkei-TOCOM Platinum Linked,1682,next-funds-nikkei-tocom-platinum-li,JPY
japan,jp,953349.0,Samsung KODEX KOSPI 200 Securities,1313,samsung-kodex-kospi-200-securities?cid=953349,JPY
japan,jp,953328.0,NEXT NOTES Nikkei-TOCOM Leveraged Gold,2036,next-notes-nikkei-tocom-leveraged-g,JPY
japan,jp,953270.0,MAXIS JPX-Nikkei 400,1593,maxis-jpx-nikkei-400,JPY
japan,jp,956403.0,DIAM Nikkei 225,1369,diam-nikkei-225,JPY
japan,jp,953249.0,Listed Index Fund China A Share CSI300,1322,listed-index-fund-china-a-share-csi,JPY
japan,jp,962258.0,Simplex JPX Nikkei 400 Bear Dbl Inv,1469,simplex-jpx-nikkei-400-bear-dbl-inv,JPY
japan,jp,1045783.0,iShares USD Investment Grade Corporate Bond JPY He,1496,ishares-usd-invest-grade-corp-bond,JPY
japan,jp,953285.0,NEXT FUNDS FTSE/JSE Africa Top 40 Linked,1323,next-funds-ftse-jse-africa-top-40-l,JPY
japan,jp,953322.0,NEXT NOTES Nifty Price Return 2x Leverage,2046,next-notes-nifty-price-return-2x-le,JPY
japan,jp,953258.0,Listed Index Fund Japan High Dividend (TSE Dividen,1698,listed-index-fund-japan-high-divide,JPY
japan,jp,1045792.0,iShares USD High Yield Corporate Bond JPY Hedged,1497,ishares-usd-hy-corp-bond-jpy-hedged,JPY
japan,jp,953294.0,NEXT FUNDS Nomura Japan Equity High Dividend 70,1577,next-funds-nomura-japan-equity-high,JPY
japan,jp,953261.0,Listed Index Fund Nikkei 225 (Mini),1578,listed-index-fund-nikkei-225-mini,JPY
japan,jp,1057108.0,NEXT FUNDS International Equity MSCI-KOKUSAI Unhed,2513,next-funds-eqt-mscikokusai-unhdg,JPY
japan,jp,1089276.0,NEXT FUNDS Emerging Market Equity MSCI-EM Unhedged,2520,nomura-nf-em-mkteq-msci-em-unhedged,JPY
japan,jp,953196.0,Daiwa ETF TOPIX Core30 Listed,1310,daiwa-etf-topix-core30-listed,JPY
japan,jp,953339.0,Nomura SSE50,1309,nomura-sse50,JPY
japan,jp,1057110.0,NEXT FUNDS Japan Bond NOMURA-BPI,2510,next-funds-japan-bond-nomura-bpi,JPY
japan,jp,1052294.0,Daiwa TOPIX High Dividend Yield 40,1651,daiwa-topix-high-dividend-yield-40,JPY
japan,jp,953275.0,MAXIS TOPIX Core 30,1344,maxis-topix-core-30,JPY
japan,jp,1056169.0,AM-One ESG,1498,am-one-esg,JPY
japan,jp,1130986.0,Nomura NF Nomura Shareholder Yield 70,2529,nomura-nf-nomura-shareholder-yld70,JPY
japan,jp,997943.0,NEXT FUNDS Nikkei 225 High Dividend Yield Stock 50,1489,nxt-fnds-nikkei225-hghdivyld-50,JPY
japan,jp,953352.0,Simplex China Bull 2x H-share,1572,simplex-china-bull-2x-h-share,JPY
japan,jp,953225.0,ETFS WTI Crude Oil,1690,etfs-crude-oil?cid=953225,JPY
japan,jp,962260.0,Simplex JPX Nikkei 400 Bull Leverag,1467,simplex-jpx-nikkei-400-bull-leverag,JPY
japan,jp,1080059.0,NEXT FUNDS MSCI Japan Empowering Women Select,2518,next-funds-msci-jp-empowering-women,JPY
japan,jp,953280.0,Mitsubishi Japan Physical Silver,1542,mitsubishi-japan-physical-silver,JPY
japan,jp,953351.0,Simplex China Bear -1x H-share,1573,simplex-china-bear-1x-h-share,JPY
japan,jp,953318.0,NEXT NOTES F-KOSPI 200 Inverse,2034,next-notes-f-kospi-200-inverse,JPY
japan,jp,953329.0,NEXT NOTES S&P 500 Dividend Aristocrats Net Total,2044,next-notes-sp-500-dividend-aristoc,JPY
japan,jp,953246.0,JASDAQ-Top20,1551,jasdaq-top20,JPY
japan,jp,953298.0,NEXT FUNDS Thai Stock SET50,1559,next-funds-thai-stock-set50,JPY
japan,jp,953254.0,Listed Index Fund International Bond (Citi WGBI) M,1677,listed-index-fund-international-bon,JPY
japan,jp,953188.0,ChinaAMC CSI 300,1575,chinaamc-csi-300,JPY
japan,jp,953252.0,Listed Index Fund Emerging Bond (Barclays Local EM,1566,listed-index-fund-emerging-bond-ba,JPY
japan,jp,962255.0,Nomura NF JPX Nikkei 400 Leveraged,1470,nomura-nf-jpx-nikkei-400-leveraged,JPY
japan,jp,962253.0,Nomura NF JPX Nikkei 400 Double Inv,1472,nomura-nf-jpx-nikkei-400-double-inv,JPY
japan,jp,962243.0,Daiwa Japan JPX Nikkei 400 Leverage,1464,daiwa-japan-jpx-nikkei-400-leverage,JPY
japan,jp,1075242.0,Mukam Maxis J-REIT Core,2517,mukam-maxis-j-reit-core,JPY
japan,jp,953304.0,NEXT FUNDS TOPIX-17 Electric Power & Gas,1627,next-funds-topix-17-electric-power,JPY
japan,jp,953189.0,CSOP FTSE China A50,1576,csop-ftse-china-a50,JPY
japan,jp,1137468.0,Listed Index Fund J-REIT (Tokyo Stock Exchange REI,2552,listedindexfundjtse-reitbimonthmini,JPY
japan,jp,953301.0,NEXT FUNDS TOPIX-17 Commercial & Wholesale Trade,1629,next-funds-topix-17-commercial-wh,JPY
japan,jp,953320.0,NEXT NOTES HSI Short,2032,next-notes-hsi-short,JPY
japan,jp,956414.0,UBS MSCI Europe UCITS,1386,ubs-msci-europe-ucits,JPY
japan,jp,1011913.0,NEXT NOTES AI Companies 70 Net Total Return,2067,next-notes-ai-comp-70-net-tr,JPY
japan,jp,956419.0,Daiwa Japan TOPIX Inverse,1457,daiwa-japan-topix-inverse,JPY
japan,jp,1052392.0,MUKAM MAXIS High Yield J-REIT,1660,mukam-maxis-high-yield-jreit,JPY
japan,jp,953299.0,NEXT FUNDS TOPIX-17 Automobiles & Transportation E,1622,next-funds-topix-17-automobiles-t,JPY
japan,jp,953321.0,NEXT NOTES KOSPI 200 Leverage,2033,next-notes-kospi-200-leverage,JPY
japan,jp,1011890.0,NEXT NOTES Japan Equity High Beta Select 30 Net To,2068,next-notes-jp-hi-b-select-30-net-tr,JPY
japan,jp,953236.0,iShares JPX-Nikkei 400,1364,ishares-jpx-nikkei-400,JPY
japan,jp,953343.0,Nomura TSE Electric Listed,1613,nomura-tse-electric-listed,JPY
japan,jp,953319.0,NEXT NOTES HSI Leveraged,2031,next-notes-hsi-leveraged,JPY
japan,jp,953208.0,Daiwa ETF TOPIX-17 IT & Services Others,1643,daiwa-etf-topix-17-it-services-ot,JPY
japan,jp,953200.0,Daiwa ETF TOPIX-17 Banks,1648,daiwa-etf-topix-17-banks,JPY
japan,jp,953326.0,NEXT NOTES Nikkei-TOCOM Inverse Gold,2037,next-notes-nikkei-tocom-inverse-gol,JPY
japan,jp,953199.0,Daiwa ETF TOPIX-17 Automobiles & Transportation Eq,1639,daiwa-etf-topix-17-automobiles-tr,JPY
japan,jp,953273.0,MAXIS S&P Mitsubishi Group,1670,maxis-sp-mitsubishi-group,JPY
japan,jp,1013277.0,MAXIS JPX-Nikkei Mid and Small Cap,1492,maxis-jpx-nikkei-mid-and-small-cap,JPY
japan,jp,953221.0,ETFS Grains,1688,etfs-grains-dj-ubsci-etc?cid=953221,JPY
japan,jp,1057106.0,NEXT FUNDS International Equity MSCI-KOKUSAI Yen-H,2514,next-funds-eqt-mscikokusai-yenhdg,JPY
japan,jp,953203.0,Daiwa ETF TOPIX-17 Electric Appliances & Precision,1642,daiwa-etf-topix-17-electric-applian,JPY
japan,jp,953357.0,Simplex NY Dow Jones,1679,simplex-ny-dow-jones,JPY
japan,jp,956405.0,UBS EURO STOXX 50 UCITS,1385,ubs-euro-stoxx-50-ucits,JPY
japan,jp,953310.0,NEXT FUNDS TOPIX-17 Pharmaceutical,1621,next-funds-topix-17-pharmaceutical,JPY
japan,jp,953215.0,Daiwa ETF TSE Electric Listed,1610,daiwa-etf-tse-electric-listed,JPY
japan,jp,962242.0,Daiwa Japan JPX Nikkei 400 Inverse,1465,daiwa-japan-jpx-nikkei-400-inverse,JPY
japan,jp,953307.0,NEXT FUNDS TOPIX-17 Foods,1617,next-funds-topix-17-foods,JPY
japan,jp,953306.0,NEXT FUNDS TOPIX-17 Financials Ex Banks,1632,next-funds-topix-17-financials-ex-b,JPY
japan,jp,962239.0,BRJ iShares MSCI Japan Min Vol,1477,brj-ishares-msci-japan-min-vol,JPY
japan,jp,1052296.0,Daiwa MSCI Japan ESG Select Leaders,1653,daiwa-msci-japan-esg-select-leaders,JPY
japan,jp,962259.0,Simplex JPX Nikkei 400 Bear Inverse,1468,simplex-jpx-nikkei-400-bear-inverse,JPY
japan,jp,1122465.0,Nochu NZAM TOPIX,2524,nochu-nzam-topix,JPY
japan,jp,953347.0,S&P GSCI Energy&Metals THEAM Easy UCITS C,1327,sp-gsci-capped-component-35-20-usd?cid=953347,JPY
japan,jp,953263.0,Listed Index Fund TOPIX Ex-Financials,1586,listed-index-fund-topix-ex-financia,JPY
japan,jp,956412.0,UBS MSCI Switzerland 20 35 UCITS,1391,ubs-msci-switzerland-20-35-ucits,JPY
japan,jp,953218.0,ETFS Copper,1693,etfs-copper?cid=953218,JPY
japan,jp,953302.0,NEXT FUNDS TOPIX-17 Construction & Materials,1619,next-funds-topix-17-construction,JPY
japan,jp,953205.0,Daiwa ETF TOPIX-17 Energy Resources,1635,daiwa-etf-topix-17-energy-resources,JPY
japan,jp,956410.0,UBS MSCI USA UCITS,1393,ubs-msci-usa-ucits,JPY
japan,jp,962246.0,DIAM JPX Nikkei 400,1474,diam-jpx-nikkei-400,JPY
japan,jp,953313.0,NEXT FUNDS TOPIX-17 Retail Trade,1630,next-funds-topix-17-retail-trade,JPY
japan,jp,953350.0,Samsung KODEX Samsung Group,1584,samsung-kodex-samsung-group?cid=953350,JPY
japan,jp,953281.0,Mizuho Gold,1683,mizuho-gold,JPY
japan,jp,956408.0,UBS MSCI Pacific ex Japan UCITS,1390,ubs-msci-pacific-ex-japan-ucits,JPY
japan,jp,956409.0,UBS MSCI United Kingdom UCITS,1392,ubs-msci-united-kingdom-ucits,JPY
japan,jp,953300.0,NEXT FUNDS TOPIX-17 Banks,1631,next-funds-topix-17-banks,JPY
japan,jp,953223.0,ETFS Physical Silver,1673,etfs-physical-silver?cid=953223,JPY
japan,jp,962252.0,Nikko MSCI JP Eq High Div Low Vol,1399,nikko-msci-jp-eq-high-div-low-vol,JPY
japan,jp,953278.0,Mitsubishi Japan Physical Palladium,1543,mitsubishi-japan-physical-palladium,JPY
japan,jp,953330.0,NEXT NOTES S&P Singapore REIT Net Total Return,2045,next-notes-sp-singapore-reit-net-t,JPY
japan,jp,953308.0,NEXT FUNDS TOPIX-17 IT & Services,1626,next-funds-topix-17-it-services,JPY
japan,jp,956411.0,UBS MSCI World UCITS,1394,ubs-msci-world-ucits,JPY
japan,jp,953305.0,NEXT FUNDS TOPIX-17 Energy Resources,1618,next-funds-topix-17-energy-resource,JPY
japan,jp,953284.0,NEXT FUNDS FTSE Bursa Malaysia KLCI,1560,next-funds-ftse-bursa-malaysia-klci,JPY
japan,jp,953323.0,NEXT NOTES Nifty Total Return Daily Inverse,2047,next-notes-nifty-total-return-daily,JPY
japan,jp,953346.0,Russell/Nomura Small Cap Core,1312,russell-nomura-small-cap-core,JPY
japan,jp,953216.0,ETFS Agriculture,1687,etfs-agriculture-dj-aigci?cid=953216,JPY
japan,jp,1120038.0,MAXIS TOPIX Ex-Financials,2523,maxis-topix-ex-financials,JPY
japan,jp,953187.0,ABF Pan Asia Bond,1349,abf-pan-asia-bond-hk?cid=953187,JPY
japan,jp,953197.0,Daiwa ETF TOPIX Ex-Financials,1585,daiwa-etf-topix-ex-financials,JPY
japan,jp,1122462.0,Nochu NZAM Nikkei 225,2525,nochu-nzam-nikkei-225,JPY
japan,jp,953309.0,NEXT FUNDS TOPIX-17 Machinery,1624,next-funds-topix-17-machinery,JPY
japan,jp,953220.0,ETFS Gasoline,1691,etfs-gasoline-it?cid=953220,JPY
japan,jp,956406.0,UBS MSCI EMU UCITS,1387,ubs-msci-emu-ucits,JPY
japan,jp,962254.0,Nomura NF JPX Nikkei 400 Inverse,1471,nomura-nf-jpx-nikkei-400-inverse,JPY
japan,jp,962244.0,Daiwa TOPIX 17 Raw Mat Chem,1637,daiwa-topix-17-raw-mat-chem,JPY
japan,jp,953303.0,NEXT FUNDS TOPIX-17 Electric Applicances & Precisi,1625,next-funds-topix-17-electric-applic,JPY
japan,jp,1011891.0,NEXT NOTES Japan Equity Low Beta Select 50 Net Tot,2069,next-notes-jp-lw-b-select-50-net-tr,JPY
japan,jp,956415.0,UBS FTSE 100 UCITS,1389,ubs-ftse-100-ucits,JPY
japan,jp,953315.0,NEXT FUNDS TOPIX-17 Transportation & Logistics,1628,next-funds-topix-17-transportation,JPY
japan,jp,956404.0,NEXT NOTES Nomura Japan Equity High,2048,next-notes-nomura-japan-equity-high,JPY
japan,jp,953331.0,NEXT NOTES Stoxx Asean Five Select Dividend 50 Net,2043,next-notes-stoxx-asean-five-select,JPY
japan,jp,953210.0,Daiwa ETF TOPIX-17 Pharmaceutical,1638,daiwa-etf-topix-17-pharmaceutical,JPY
japan,jp,953311.0,NEXT FUNDS TOPIX-17 Raw Materials & Chemicals,1620,next-funds-topix-17-raw-materials,JPY
japan,jp,953312.0,NEXT FUNDS TOPIX-17 Real Estate,1633,next-funds-topix-17-real-estate,JPY
japan,jp,956407.0,UBS MSCI EMU Small Cap UCITS,1388,ubs-msci-emu-small-cap-ucits,JPY
japan,jp,953204.0,Daiwa ETF TOPIX-17 Electric Power & Gas,1644,daiwa-etf-topix-17-electric-power,JPY
japan,jp,1122463.0,Nochu NZAM JPX-Nikkei400,2526,nochu-nzam-jpx-nikkei400,JPY
japan,jp,953201.0,Daiwa ETF TOPIX-17 Commercial & Wholesale Trade,1646,daiwa-etf-topix-17-commercial-who,JPY
japan,jp,953202.0,Daiwa ETF TOPIX-17 Construction & Materials,1636,daiwa-etf-topix-17-construction-m,JPY
japan,jp,1122464.0,Nochu NZAM J-REIT Core Index,2527,nochu-nzam-j-reit-core-index,JPY
japan,jp,953345.0,NZAM ETF TOPIX Ex-Financials,1596,nzam-etf-topix-ex-financials,JPY
japan,jp,1122481.0,Daiwa Tokyo Stock Exchange REIT Core Index,2528,daiwa-tokyo-reit-core-index,JPY
japan,jp,962249.0,ETFS Physical Platinum,1674,etfs-physical-platinum?cid=962249,JPY
japan,jp,953206.0,Daiwa ETF TOPIX-17 Financials Ex Banks,1649,daiwa-etf-topix-17-financials-ex-ba,JPY
japan,jp,953207.0,Daiwa ETF TOPIX-17 Foods,1634,daiwa-etf-topix-17-foods,JPY
japan,jp,953314.0,NEXT FUNDS TOPIX-17 Steel & NonFerrous,1623,next-funds-topix-17-steel-nonferr,JPY
japan,jp,953209.0,Daiwa ETF TOPIX-17 Machinery,1641,daiwa-etf-topix-17-machinery,JPY
japan,jp,1057093.0,MAXIS Japan Equity High Dividend 70 Market Neutral,1499,maxis-japan-eqt-high-div-70-market,JPY
japan,jp,953211.0,Daiwa ETF TOPIX-17 Real Estate,1650,daiwa-etf-topix-17-real-estate,JPY
